"Horse Farming in Australia","IBISWorld","Jersey City, United States","Industry & Manufacturing","Australia",900,"http://www.reportbuyer.com/industry_manufacturing/agriculture/horse_farming_australia.html","Published on 05-May-2011",31
"Farm Produce and Supplies Wholesaling n.e.c. in Australia","IBISWorld","Jersey City, United States","Industry & Manufacturing","Australia",923,"http://www.reportbuyer.com/industry_manufacturing/agriculture/agricultural_services/farm_produce_supplies_wholesaling_n_e_c_australia.html","Published on 04-Jun-2007",39
"Petroleum Product Wholesaling in Australia","IBISWorld","Jersey City, United States","Energy & Utilities","Australia",923,"http://www.reportbuyer.com/energy_utilities/oil_gas/petroleum_product_wholesaling_australia.html","Published on 17-Jan-2008",34
"Timber Wholesaling in Australia","IBISWorld","Jersey City, United States","Industry & Manufacturing","Australia",923,"http://www.reportbuyer.com/industry_manufacturing/wood/timber_wholesaling_australia.html","Published on 04-Apr-2011",37
"Household Good Wholesaling n.e.c. in Australia","IBISWorld","Jersey City, United States","Consumer Goods & Retail","Australia",923,"http://www.reportbuyer.com/consumer_goods_retail/home_garden/household_good_wholesaling_n_e_c_australia.html","Published on 07-Nov-2007",36
"Mining and Construction Machinery Manufacturing in Australia","IBISWorld","Jersey City, United States","Industry & Manufacturing","Australia",900,"http://www.reportbuyer.com/industry_manufacturing/machinery/industrial_machinery/mining_construction_machinery_manufacturing_australia.html","Published on 05-May-2011",35
"Cloud Computing in Australia","IBISWorld","Jersey City, United States","Computing & Electronics","Australia",907,"http://www.reportbuyer.com/computing_electronics/services/cloud_computing/cloud_computing_australia.html","Published on 06-Jun-2011",37
"Online Information Services in Australia","IBISWorld","Jersey City, United States","Computing & Electronics","Australia",907,"http://www.reportbuyer.com/computing_electronics/services/online_information_services_australia.html","Published on 06-Jun-2011",40
"Book and Magazine Wholesaling in Australia","IBISWorld","Jersey City, United States","Leisure & Media","Australia",845,"http://www.reportbuyer.com/leisure_media/publishing/book_magazine_wholesaling_australia.html","Published on 01-Jan-2011",33
"Plumbing Services in Australia","IBISWorld","Jersey City, United States","Industry & Manufacturing","Australia",829,"http://www.reportbuyer.com/industry_manufacturing/construction/plumbing_services_australia.html","Published on 08-Aug-2011",34
"Toiletry and Cosmetic Goods Wholesaling in Australia","IBISWorld","Jersey City, United States","Consumer Goods & Retail","Australia",923,"http://www.reportbuyer.com/consumer_goods_retail/cosmetics_grooming/toiletry_cosmetic_goods_wholesaling_australia.html","Published on 06-Jun-2008",43
"Supermarkets and Other Grocery (except Convenience) Stores in Australia","IBISWorld","Jersey City, United States","Consumer Goods & Retail","Australia",923,"http://www.reportbuyer.com/consumer_goods_retail/food_retailing/supermarkets_grocery_except_convenience_stores_australia.html","Published on 10-Jun-2008",64
"Specialised Food Retailing n.e.c. in Australia","IBISWorld","Jersey City, United States","Consumer Goods & Retail","Australia",923,"http://www.reportbuyer.com/consumer_goods_retail/food_retailing/specialised_food_retailing_n_e_c_australia.html","Published on 05-Feb-2008",42
"Storage and Warehousing Operations (except Grain Silos) in China","IBISWorld","Jersey City, United States","Transport & Travel","China",821,"http://www.reportbuyer.com/transport_travel/logistics_shipping/warehousing_distribution/storage_warehousing_operations_except_grain_silos_china.html","Published on 07-Jul-2011",34
"Glazing Services in Australia","IBISWorld","Jersey City, United States","Industry & Manufacturing","Australia",900,"http://www.reportbuyer.com/industry_manufacturing/construction/glazing_services_australia.html","Published on 05-May-2011",31
"Weddings in Australia","IBISWorld","Jersey City, United States","Consumer Goods & Retail","Australia",907,"http://www.reportbuyer.com/consumer_goods_retail/general_retailing/weddings_australia.html","Published on 05-May-2011",25
"Domestic Appliance (except Computer and Software) Retailing in Australia","IBISWorld","Jersey City, United States","Consumer Goods & Retail","Australia",923,"http://www.reportbuyer.com/consumer_goods_retail/appliances/domestic_appliance_except_computer_software_retailing_australia.html","Published on 13-Mar-2008",55
"Automotive Fuel Retailing in Australia","IBISWorld","Jersey City, United States","Energy & Utilities","Australia",907,"http://www.reportbuyer.com/energy_utilities/oil_gas/petrol_motor_fuel/automotive_fuel_retailing_australia.html","Published on 06-Jun-2011",31
"Global Investment Banking and Brokerage","IBISWorld","Jersey City, United States","Banking & Finance","All",853,"http://www.reportbuyer.com/banking_finance/investments/global_investment_banking_brokerage.html","Published on 06-Jun-2011",43
"Pharmacies and Drug Retailers in China","IBISWorld","Jersey City, United States","Pharma &amp; Healthcare","China",821,"http://www.reportbuyer.com/pharma_healthcare/sales_marketing/pharmacies_drug_retailers_china.html","Published on 03-Mar-2011",47
"Garden Suppliest Retailing in Australia","IBISWorld","Jersey City, United States","Consumer Goods & Retail","Australia",923,"http://www.reportbuyer.com/consumer_goods_retail/home_garden/garden/garden_suppliest_retailing_australia.html","Published on 30-Jun-2006",25
"Pharmaceutical Goods Retailing in Australia","IBISWorld","Jersey City, United States","Pharma &amp; Healthcare","Australia",923,"http://www.reportbuyer.com/pharma_healthcare/pharmacy/pharmaceutical_goods_retailing_australia.html","Published on 06-Jun-2008",49
"Cosmetics and Toiletries Retailing in Australia","IBISWorld","Jersey City, United States","Consumer Goods & Retail","Australia",923,"http://www.reportbuyer.com/consumer_goods_retail/cosmetics_grooming/make_up/cosmetics_toiletries_retailing_australia.html","Published on 26-Mar-2008",33
"Roofing Services in Australia","IBISWorld","Jersey City, United States","Industry & Manufacturing","Australia",829,"http://www.reportbuyer.com/industry_manufacturing/construction/roofing_services_australia.html","Published on 09-Sep-2011",29
"Household Equipment Repair Services n.e.c. in Australia","IBISWorld","Jersey City, United States","Consumer Goods & Retail","Australia",923,"http://www.reportbuyer.com/consumer_goods_retail/misc_consumer_goods_retail/household_equipment_repair_services_n_e_c_australia.html","Published on 21-Feb-2006",17
"Motor Cycle Dealing in Australia","IBISWorld","Jersey City, United States","Automotive","Australia",907,"http://www.reportbuyer.com/automotive/sales_dealers/motor_cycle_dealing_australia.html","Published on 06-Jun-2011",28
"Trailer and Caravan Dealing in Australia","IBISWorld","Jersey City, United States","Automotive","Australia",923,"http://www.reportbuyer.com/automotive/sales_dealers/trailer_caravan_dealing_australia.html","Published on 02-Feb-2010",30
"Hotels and Resorts in Australia","IBISWorld","Jersey City, United States","Leisure & Media","Australia",876,"http://www.reportbuyer.com/leisure_media/tourism_travel/hotels/hotels_resorts_australia.html","Published on 07-Jul-2011",34
"Automotive Electrical Services in Australia","IBISWorld","Jersey City, United States","Automotive","Australia",860,"http://www.reportbuyer.com/automotive/country_overview_automotive/automotive_electrical_services_australia.html","Published on 02-Feb-2011",29
"Smash Repairing in Australia","IBISWorld","Jersey City, United States","Automotive","Australia",845,"http://www.reportbuyer.com/automotive/services_automotive/smash_repairing_australia.html","Published on 12-Dec-2010",29
"Other Accommodation in Australia","IBISWorld","Jersey City, United States","Leisure & Media","Australia",923,"http://www.reportbuyer.com/leisure_media/tourism_travel/hotels/accommodation_australia.html","Published on 14-Apr-2008",38
"Clubs in Australia","IBISWorld","Jersey City, United States","Leisure & Media","Australia",829,"http://www.reportbuyer.com/leisure_media/bars_clubs/clubs_australia.html","Published on 09-Sep-2011",30
"Long Distance Bus Transport in Australia","IBISWorld","Jersey City, United States","Transport & Travel","Australia",845,"http://www.reportbuyer.com/transport_travel/bus/long_distance_bus_transport_australia.html","Published on 01-Jan-2011",30
"Short Distance Bus Transport (Including Tramway) in Australia","IBISWorld","Jersey City, United States","Transport & Travel","Australia",923,"http://www.reportbuyer.com/transport_travel/bus/short_distance_bus_transport_including_tramway_australia.html","Published on 06-Jun-2008",34
"Grain Storage in Australia","IBISWorld","Jersey City, United States","Transport & Travel","Australia",907,"http://www.reportbuyer.com/transport_travel/logistics_shipping/warehousing_distribution/grain_storage_australia.html","Published on 06-Jun-2011",32
"Inland Water Transport in Australia","IBISWorld","Jersey City, United States","Transport & Travel","Australia",860,"http://www.reportbuyer.com/transport_travel/maritime/inland_water_transport_australia.html","Published on 02-Feb-2011",31
"Pipeline Transport in Australia","IBISWorld","Jersey City, United States","Energy & Utilities","Australia",860,"http://www.reportbuyer.com/energy_utilities/oil_gas/distribution/pipeline_transport_australia.html","Published on 01-Jan-2011",30
"Scheduled International Air Transport in Australia","IBISWorld","Jersey City, United States","Transport & Travel","Australia",923,"http://www.reportbuyer.com/transport_travel/air/airlines/scheduled_international_air_transport_australia.html","Published on 04-Jun-2008",45
"Scheduled Domestic Air Transport in Australia","IBISWorld","Jersey City, United States","Transport & Travel","Australia",923,"http://www.reportbuyer.com/transport_travel/air/airlines/scheduled_domestic_air_transport_australia.html","Published on 03-Mar-2008",44
"Stevedoring in Australia","IBISWorld","Jersey City, United States","Transport & Travel","Australia",923,"http://www.reportbuyer.com/transport_travel/maritime/port_harbours/stevedoring_australia.html","Published on 17-Sep-2007",38
"Nature Parks and Other Similar Institutions in the US","IBISWorld","Jersey City, United States","Leisure & Media","United States",751,"http://www.reportbuyer.com/leisure_media/attractions/nature_parks_similar_institutions_us.html","Published on 30-Jul-2007",40
"Zoos and Botanical Gardens in the US","IBISWorld","Jersey City, United States","Leisure & Media","United States",751,"http://www.reportbuyer.com/leisure_media/attractions/zoos_botanical_gardens_us.html","Published on 28-Apr-2006",31
"Water Transport Terminals in Australia","IBISWorld","Jersey City, United States","Transport & Travel","Australia",837,"http://www.reportbuyer.com/transport_travel/maritime/port_harbours/water_transport_terminals_australia.html","Published on 11-Nov-2010",29
"Services to Water Transport n.e.c. in Australia","IBISWorld","Jersey City, United States","Transport & Travel","Australia",923,"http://www.reportbuyer.com/transport_travel/maritime/port_harbours/services_water_transport_n_e_c_australia.html","Published on 08-Oct-2007",39
"Services to Air Transport in Australia","IBISWorld","Jersey City, United States","Transport & Travel","Australia",923,"http://www.reportbuyer.com/transport_travel/air/services_air_transport_australia.html","Published on 12-Jul-2007",43
"Freight Forwarding (Except Road) in Australia","IBISWorld","Jersey City, United States","Transport & Travel","Australia",923,"http://www.reportbuyer.com/transport_travel/logistics_shipping/freight_forwarding_except_road_australia.html","Published on 03-Apr-2008",39
"Services to Transport n.e.c. in Australia","IBISWorld","Jersey City, United States","Automotive","Australia",923,"http://www.reportbuyer.com/automotive/services_automotive/services_transport_n_e_c_australia.html","Published on 31-Jan-2008",30
"Storage n.e.c. in Australia","IBISWorld","Jersey City, United States","Transport & Travel","Australia",923,"http://www.reportbuyer.com/transport_travel/logistics_shipping/warehousing_distribution/storage_n_e_c_australia.html","Published on 11-Feb-2008",29
"Postal Services in Australia","IBISWorld","Jersey City, United States","Transport & Travel","Australia",923,"http://www.reportbuyer.com/transport_travel/logistics_shipping/courier_postal_services/postal_services_australia.html","Published on 09-Sep-2010",33
"Other Telecommunication Services in Australia","IBISWorld","Jersey City, United States","Telecoms","Australia",923,"http://www.reportbuyer.com/telecoms/misc_telecoms/telecommunication_services_australia.html","Published on 30-Apr-2008",47
"Central Bank in Australia","IBISWorld","Jersey City, United States","Banking & Finance","Australia",923,"http://www.reportbuyer.com/banking_finance/banking/central_bank_australia.html","Published on 04-Dec-2008",39
"Money Market Dealers in Australia","IBISWorld","Jersey City, United States","Banking & Finance","Australia",923,"http://www.reportbuyer.com/banking_finance/financial_services/money_market_dealers_australia.html","Published on 04-Apr-2011",33
"Foreign Banks in Australia","IBISWorld","Jersey City, United States","Banking & Finance","Australia",845,"http://www.reportbuyer.com/banking_finance/banking/retail_banking/foreign_banks_australia.html","Published on 12-Dec-2010",44
"Mortgage Brokers in Australia","IBISWorld","Jersey City, United States","Banking & Finance","Australia",907,"http://www.reportbuyer.com/banking_finance/lending/mortgages/mortgage_brokers_australia.html","Published on 06-Jun-2011",37
"Other Financiers in Australia","IBISWorld","Jersey City, United States","Banking & Finance","Australia",923,"http://www.reportbuyer.com/banking_finance/country_overview_banking_finance/financiers_australia.html","Published on 17-Apr-2008",38
"Health Insurance in Australia","IBISWorld","Jersey City, United States","Banking & Finance","Australia",876,"http://www.reportbuyer.com/banking_finance/insurance/non_life/health_insurance_australia.html","Published on 08-Aug-2011",41
"Life Insurance in Australia","IBISWorld","Jersey City, United States","Banking & Finance","Australia",876,"http://www.reportbuyer.com/banking_finance/insurance/life/life_insurance_australia.html","Published on 07-Jul-2011",41
"General Insurance in Australia","IBISWorld","Jersey City, United States","Banking & Finance","Australia",923,"http://www.reportbuyer.com/banking_finance/insurance/non_life/general_insurance_australia.html","Published on 07-Jul-2010",51
"Investment Banking &amp; Securities Brokerage in Australia","IBISWorld","Jersey City, United States","Banking & Finance","Australia",860,"http://www.reportbuyer.com/banking_finance/investments/investment_banking_securities_brokerage_australia.html","Published on 02-Feb-2011",39
"Funds Management (except Superannuation Funds) in Australia","IBISWorld","Jersey City, United States","Banking & Finance","Australia",907,"http://www.reportbuyer.com/banking_finance/investments/funds/funds_management_except_superannuation_funds_australia.html","Published on 05-May-2011",38
"Investment Advice in Australia","IBISWorld","Jersey City, United States","Banking & Finance","Australia",923,"http://www.reportbuyer.com/banking_finance/investments/investment_advice_australia.html","Published on 30-Jan-2008",48
"Superannuation Funds Management in Australia","IBISWorld","Jersey City, United States","Banking & Finance","Australia",907,"http://www.reportbuyer.com/banking_finance/investments/funds/superannuation_funds_management_australia.html","Published on 06-Jun-2011",41
"Commercial Property Operators and Developers in Australia","IBISWorld","Jersey City, United States","Industry & Manufacturing","Australia",923,"http://www.reportbuyer.com/industry_manufacturing/construction/commercial/commercial_property_operators_developers_australia.html","Published on 27-Apr-2006",50
"Residential Property Operators and Developers in Australia","IBISWorld","Jersey City, United States","Banking & Finance","Australia",907,"http://www.reportbuyer.com/banking_finance/property_finance/residential_property_operators_developers_australia_1.html","Published on 05-May-2011",31
"Road Freight Transport in Australia","IBISWorld","Jersey City, United States","Transport & Travel","Australia",876,"http://www.reportbuyer.com/transport_travel/logistics_shipping/road_freight_transport_australia.html","Published on 07-Jul-2011",37
"Other Transport Equipment Leasing in Australia","IBISWorld","Jersey City, United States","Banking & Finance","Australia",923,"http://www.reportbuyer.com/banking_finance/misc_banking_finance/transport_equipment_leasing_australia.html","Published on 14-Feb-2008",26
"Consulting Engineering Services in Australia","IBISWorld","Jersey City, United States","Business &amp; Government","Australia",923,"http://www.reportbuyer.com/business_government/consulting/consulting_engineering_services_australia.html","Published on 25-Mar-2008",55
"Marine Cargo Handling in Australia","IBISWorld","Jersey City, United States","Transport & Travel","Australia",923,"http://www.reportbuyer.com/transport_travel/maritime/port_harbours/marine_cargo_handling_australia.html","Published on 03-Mar-2011",34
"Scientific Research in Australia","IBISWorld","Jersey City, United States","Business &amp; Government","Australia",923,"http://www.reportbuyer.com/business_government/misc_business_services/scientific_research_australia.html","Published on 04-Apr-2011",43
"Commercial Art and Display Services in Australia","IBISWorld","Jersey City, United States","Business &amp; Government","Australia",923,"http://www.reportbuyer.com/business_government/advertising_marketing/commercial_art_display_services_australia.html","Published on 31-Jan-2008",38
"Management Consulting and Business Management Services in Australia","IBISWorld","Jersey City, United States","Business &amp; Government","Australia",923,"http://www.reportbuyer.com/business_government/consulting/management_consulting_business_management_services_australia.html","Published on 22-Feb-2008",44
"Government Schools in Australia","IBISWorld","Jersey City, United States","Business &amp; Government","Australia",845,"http://www.reportbuyer.com/business_government/education/government_schools_australia.html","Published on 12-Dec-2010",39
"Contract Staff Services in Australia","IBISWorld","Jersey City, United States","Business &amp; Government","Australia",923,"http://www.reportbuyer.com/business_government/human_resources/recruitment/contract_staff_services_australia.html","Published on 14-Apr-2008",40
"Secretarial Services in Australia","IBISWorld","Jersey City, United States","Business &amp; Government","Australia",923,"http://www.reportbuyer.com/business_government/human_resources/recruitment/secretarial_services_australia.html","Published on 01-Jan-2009",33
"Security and Investigative Services (Except Police) in Australia","IBISWorld","Jersey City, United States","Business &amp; Government","Australia",923,"http://www.reportbuyer.com/business_government/security/security_services/security_investigative_services_except_police_australia.html","Published on 10-Jan-2008",42
"Pest Control Services in Australia","IBISWorld","Jersey City, United States","Pharma &amp; Healthcare","Australia",923,"http://www.reportbuyer.com/pharma_healthcare/healthcare/pest_control_services_australia.html","Published on 08-Jan-2008",30
"Contract Packing Services n.e.c. in Australia","IBISWorld","Jersey City, United States","Automotive","Australia",923,"http://www.reportbuyer.com/automotive/services_automotive/contract_packing_services_n_e_c_australia.html","Published on 05-Feb-2008",29
"Local Government Administration in Australia","IBISWorld","Jersey City, United States","Business &amp; Government","Australia",923,"http://www.reportbuyer.com/business_government/government/local_government_administration_australia_1.html","Published on 12-Dec-2009",32
"Preschool Education in Australia","IBISWorld","Jersey City, United States","Business &amp; Government","Australia",860,"http://www.reportbuyer.com/business_government/education/preschool_education_australia.html","Published on 02-Feb-2011",34
"Online Education in Australia","IBISWorld","Jersey City, United States","Business &amp; Government","Australia",907,"http://www.reportbuyer.com/business_government/education/online_education_australia.html","Published on 06-Jun-2011",37
"Household Pet Products and Services in Australia","IBISWorld","Jersey City, United States","Consumer Goods & Retail","Australia",829,"http://www.reportbuyer.com/consumer_goods_retail/pet_products/household_pet_products_services_australia.html","Published on 08-Aug-2011",28
"Secondary Education in Australia","IBISWorld","Jersey City, United States","Business &amp; Government","Australia",923,"http://www.reportbuyer.com/business_government/education/secondary_education_australia.html","Published on 01-Sep-2005",40
"Combined Primary and Secondary Education in Australia","IBISWorld","Jersey City, United States","Business &amp; Government","Australia",923,"http://www.reportbuyer.com/business_government/education/combined_primary_secondary_education_australia.html","Published on 18-Nov-2005",41
"Special School Education in Australia","IBISWorld","Jersey City, United States","Business &amp; Government","Australia",923,"http://www.reportbuyer.com/business_government/education/special_school_education_australia.html","Published on 01-Sep-2005",29
"Pest and Weed Control Services in Australia","IBISWorld","Jersey City, United States","Business &amp; Government","Australia",907,"http://www.reportbuyer.com/business_government/misc_business_services/pest_weed_control_services_australia.html","Published on 06-Jun-2011",26
"Technical and Further Education in Australia","IBISWorld","Jersey City, United States","Business &amp; Government","Australia",907,"http://www.reportbuyer.com/business_government/education/technical_further_education_australia.html","Published on 06-Jun-2011",37
"Other Education in Australia","IBISWorld","Jersey City, United States","Business &amp; Government","Australia",923,"http://www.reportbuyer.com/business_government/education/education_australia.html","Published on 13-Aug-2007",44
"Hospitals (Except Psychiatric Hospitals) in Australia","IBISWorld","Jersey City, United States","Pharma &amp; Healthcare","Australia",923,"http://www.reportbuyer.com/pharma_healthcare/healthcare/hospital/hospitals_except_psychiatric_hospitals_australia.html","Published on 05-Mar-2008",53
"Psychiatric Hospitals in Australia","IBISWorld","Jersey City, United States","Pharma &amp; Healthcare","Australia",845,"http://www.reportbuyer.com/pharma_healthcare/healthcare/hospital/psychiatric_hospitals_australia.html","Published on 12-Dec-2010",29
"Paper Wholesaling in Australia","IBISWorld","Jersey City, United States","Industry & Manufacturing","Australia",900,"http://www.reportbuyer.com/industry_manufacturing/pulp_paper/paper_wholesaling_australia.html","Published on 05-May-2011",35
"Confectionery and Soft Drink Wholesaling in Australia","IBISWorld","Jersey City, United States","Food & Drink","Australia",907,"http://www.reportbuyer.com/food_drink/soft_drinks/confectionery_soft_drink_wholesaling_australia.html","Published on 05-May-2011",35
"Ambulance Services in Australia","IBISWorld","Jersey City, United States","Pharma &amp; Healthcare","Australia",907,"http://www.reportbuyer.com/pharma_healthcare/healthcare/ambulance_services_australia.html","Published on 06-Jun-2011",35
"Horse and Dog Racing in Australia","IBISWorld","Jersey City, United States","Consumer Goods & Retail","Australia",907,"http://www.reportbuyer.com/consumer_goods_retail/sports_recreation/horse_dog_racing_australia.html","Published on 06-Jun-2011",33
"Community Health Centres in Australia","IBISWorld","Jersey City, United States","Pharma &amp; Healthcare","Australia",923,"http://www.reportbuyer.com/pharma_healthcare/healthcare/community_health_centres_australia.html","Published on 12-Dec-2009",37
"Chiropractic Services in Australia","IBISWorld","Jersey City, United States","Pharma &amp; Healthcare","Australia",829,"http://www.reportbuyer.com/pharma_healthcare/healthcare/chiropractic_services_australia.html","Published on 09-Sep-2011",27
"Removalists in Australia","IBISWorld","Jersey City, United States","Transport & Travel","Australia",829,"http://www.reportbuyer.com/transport_travel/logistics_shipping/removalists_australia.html","Published on 09-Sep-2011",27
"State Government Administration in Australia","IBISWorld","Jersey City, United States","Business &amp; Government","Australia",923,"http://www.reportbuyer.com/business_government/government/state_government_administration_australia_1.html","Published on 10-Oct-2009",39
"Residential Care Services n.e.c. in Australia","IBISWorld","Jersey City, United States","Pharma &amp; Healthcare","Australia",923,"http://www.reportbuyer.com/pharma_healthcare/healthcare/residential_care_services_n_e_c_australia.html","Published on 13-Mar-2008",35
"Non-Residential Care Services n.e.c. in Australia","IBISWorld","Jersey City, United States","Pharma &amp; Healthcare","Australia",923,"http://www.reportbuyer.com/pharma_healthcare/healthcare/non_residential_care_services_n_e_c_australia.html","Published on 05-Mar-2008",41
"Electricity Distribution in Australia","IBISWorld","Jersey City, United States","Energy & Utilities","Australia",876,"http://www.reportbuyer.com/energy_utilities/electricity/electricity_distribution_australia.html","Published on 08-Aug-2011",33
