"The World Market for Letter Cards, Plain Postcards, and Correspondence Cards Made of Paper or Paperboard","ICON Group ","San Diego,, United States","Business &amp; Government","All",594,"http://www.reportbuyer.com/business_government/office_equipment/world_market_letter_cards_plain_postcards_correspondence_cards_made_paper_paperboard.html","Published on 13-May-2010",78
"The World Market for Boxes or Wallets Made of Paper or Paperboard and Containing Assorted Stationary","ICON Group ","San Diego,, United States","Business &amp; Government","All",594,"http://www.reportbuyer.com/business_government/office_equipment/world_market_boxes_wallets_made_paper_paperboard_containing_assorted_stationary.html","Published on 13-May-2010",94
"The World Market for Registers, Books (Account, Note, Order and Receipt), Loose-Leaf Binders, File Covers, and Sample Albums Made of Paper or Paperboard","ICON Group ","San Diego,, United States","Business &amp; Government","All",594,"http://www.reportbuyer.com/business_government/office_equipment/world_market_registers_books_account_note_order_receipt_loose_leaf_binders_file_covers_sample_albums_made_paper_paperboard.html","Published on 13-May-2010",219
"The World Market for Registers, Books (Account, Note, Order and Receipt), Letter Pads, Memo Pads, Diaries, and Similar Articles Made of Paper or Paperboard","ICON Group ","San Diego,, United States","Business &amp; Government","All",594,"http://www.reportbuyer.com/business_government/office_equipment/world_market_registers_books_account_note_order_receipt_letter_pads_memo_pads_diaries_similar_articles_made_paper_paperboard.html","Published on 13-May-2010",178
"The World Market for Paper Exercise Books","ICON Group ","San Diego,, United States","Business &amp; Government","All",594,"http://www.reportbuyer.com/business_government/office_equipment/world_market_paper_exercise_books.html","Published on 13-May-2010",112
"The World Market for Binders, Folders, and File Covers Excluding Book Covers","ICON Group ","San Diego,, United States","Business &amp; Government","All",594,"http://www.reportbuyer.com/business_government/office_equipment/world_market_binders_folders_file_covers_excluding_book_covers.html","Published on 13-May-2010",133
"The World Market for Manifold Business Forms and Interleaved Carbon Sets Made of Paper or Paperboard","ICON Group ","San Diego,, United States","Business &amp; Government","All",594,"http://www.reportbuyer.com/business_government/office_equipment/world_market_manifold_business_forms_interleaved_carbon_sets_made_paper_paperboard.html","Published on 13-May-2010",95
"The World Market for Albums for Samples or Collections Made of Paper or Paperboard","ICON Group ","San Diego,, United States","Business &amp; Government","All",594,"http://www.reportbuyer.com/business_government/office_equipment/world_market_albums_samples_collections_made_paper_paperboard.html","Published on 13-May-2010",119
"The World Market for Cut-to-Size Cigarette Paper","ICON Group ","San Diego,, United States","Consumer Goods & Retail","All",594,"http://www.reportbuyer.com/consumer_goods_retail/tobacco/world_market_cut_to_size_cigarette_paper.html","Published on 13-May-2010",109
"The World Market for Cut-to-Size Carbon, Self-Copy, and Other Copying or Transfer Papers; Duplicator Stencils; and Offset Plates of Paper","ICON Group ","San Diego,, United States","Industry & Manufacturing","All",594,"http://www.reportbuyer.com/industry_manufacturing/pulp_paper/world_market_cut_to_size_carbon_self_copy_copying_transfer_papers_duplicator_stencils_offset_plates_paper.html","Published on 13-May-2010",130
"The World Market for Cut-to-Size Toilet Paper in Rolls or Sheets","ICON Group ","San Diego,, United States","Industry & Manufacturing","All",594,"http://www.reportbuyer.com/industry_manufacturing/pulp_paper/world_market_cut_to_size_toilet_paper_rolls_sheets.html","Published on 13-May-2010",133
"The World Market for Gummed or Adhesive Paper in Strips or Rolls","ICON Group ","San Diego,, United States","Industry & Manufacturing","All",594,"http://www.reportbuyer.com/industry_manufacturing/pulp_paper/world_market_gummed_adhesive_paper_strips_rolls.html","Published on 13-May-2010",72
"The World Market for Filter Paper and Paperboard","ICON Group ","San Diego,, United States","Industry & Manufacturing","All",594,"http://www.reportbuyer.com/industry_manufacturing/pulp_paper/world_market_filter_paper_paperboard.html","Published on 13-May-2010",107
"The World Market for Bobbins, Spools, Cops, and Similar Supports Made of Paper Pulp, Paper or Paperboard","ICON Group ","San Diego,, United States","Industry & Manufacturing","All",594,"http://www.reportbuyer.com/industry_manufacturing/pulp_paper/world_market_bobbins_spools_cops_similar_supports_made_paper_pulp_paper_paperboard.html","Published on 13-May-2010",106
"The World Market for Trays, Dishes, Plates, Cups, and Similar Items Made of Paper or Paperboard","ICON Group ","San Diego,, United States","Industry & Manufacturing","All",594,"http://www.reportbuyer.com/industry_manufacturing/pulp_paper/world_market_trays_dishes_plates_cups_similar_items_made_paper_paperboard.html","Published on 13-May-2010",132
"The World Market for Paper Handkerchiefs, Tissues, Towels, Tablecloths, Bed Sheets, Linen, Garments, and Clothing Accessories","ICON Group ","San Diego,, United States","Industry & Manufacturing","All",594,"http://www.reportbuyer.com/industry_manufacturing/pulp_paper/world_market_paper_handkerchiefs_tissues_towels_tablecloths_bed_sheets_linen_garments_clothing_accessories.html","Published on 13-May-2010",188
"The World Market for Yarn Made of Wool or Animal Hair","ICON Group ","San Diego,, United States","Industry & Manufacturing","All",594,"http://www.reportbuyer.com/industry_manufacturing/textiles/world_market_yarn_made_wool_animal_hair.html","Published on 13-May-2010",149
"The World Market for Wholesale Yarn Made of Carded Wool and of At Least 85% Wool by Weight","ICON Group ","San Diego,, United States","Industry & Manufacturing","All",594,"http://www.reportbuyer.com/industry_manufacturing/textiles/world_market_wholesale_yarn_made_carded_wool_least_85_wool_weight.html","Published on 13-May-2010",109
"The World Market for Wholesale Yarn Made of Combed Wool and of At Least 85% Wool by Weight","ICON Group ","San Diego,, United States","Industry & Manufacturing","All",594,"http://www.reportbuyer.com/industry_manufacturing/textiles/world_market_wholesale_yarn_made_combed_wool_least_85_wool_weight.html","Published on 13-May-2010",117
"The World Market for Wholesale Yarn Made of Carded or Combed Fine Animal Hair","ICON Group ","San Diego,, United States","Industry & Manufacturing","All",594,"http://www.reportbuyer.com/industry_manufacturing/textiles/world_market_wholesale_yarn_made_carded_combed_fine_animal_hair.html","Published on 13-May-2010",83
"The World Market for Yarn Made of Coarse Animal Hair or of Horsehair","ICON Group ","San Diego,, United States","Industry & Manufacturing","All",594,"http://www.reportbuyer.com/industry_manufacturing/textiles/world_market_yarn_made_coarse_animal_hair_horsehair.html","Published on 13-May-2010",40
"The World Market for Yarn Made of Wool or Fine Animal Hair and of At Least 85% Wool or Fine Animal Hair by Weight for Retail Sale","ICON Group ","San Diego,, United States","Industry & Manufacturing","All",594,"http://www.reportbuyer.com/industry_manufacturing/textiles/world_market_yarn_made_wool_fine_animal_hair_least_85_wool_fine_animal_hair_weight_retail_sale.html","Published on 13-May-2010",100
"The World Market for Wholesale Yarn Made of Carded Wool and of under 85% Wool by Weight","ICON Group ","San Diego,, United States","Industry & Manufacturing","All",594,"http://www.reportbuyer.com/industry_manufacturing/textiles/world_market_wholesale_yarn_made_carded_wool_85_wool_weight.html","Published on 13-May-2010",97
"The World Market for Wholesale Yarn Made of Combed Wool and of under 85% Wool by Weight","ICON Group ","San Diego,, United States","Industry & Manufacturing","All",594,"http://www.reportbuyer.com/industry_manufacturing/textiles/world_market_wholesale_yarn_made_combed_wool_85_wool_weight.html","Published on 13-May-2010",111
"The World Market for Yarn Made of Wool or Fine Animal Hair and of under 85% Wool or Fine Animal Hair by Weight for Retail Sale","ICON Group ","San Diego,, United States","Industry & Manufacturing","All",594,"http://www.reportbuyer.com/industry_manufacturing/textiles/world_market_yarn_made_wool_fine_animal_hair_85_wool_fine_animal_hair_weight_retail_sale.html","Published on 13-May-2010",96
"The World Market for Cotton Sewing Thread","ICON Group ","San Diego,, United States","Industry & Manufacturing","All",594,"http://www.reportbuyer.com/industry_manufacturing/textiles/world_market_cotton_sewing_thread.html","Published on 13-May-2010",118
"The World Market for Wholesale Cotton Sewing Thread","ICON Group ","San Diego,, United States","Industry & Manufacturing","All",594,"http://www.reportbuyer.com/industry_manufacturing/textiles/world_market_wholesale_cotton_sewing_thread.html","Published on 13-May-2010",104
"The World Market for Cotton Sewing Thread for Retail Sale","ICON Group ","San Diego,, United States","Industry & Manufacturing","All",594,"http://www.reportbuyer.com/industry_manufacturing/textiles/world_market_cotton_sewing_thread_retail_sale.html","Published on 13-May-2010",89
"The World Market for Cotton Yarn","ICON Group ","San Diego,, United States","Industry & Manufacturing","All",594,"http://www.reportbuyer.com/industry_manufacturing/textiles/world_market_cotton_yarn.html","Published on 13-May-2010",195
"The World Market for Cotton Yarn of At Least 85% Cotton by Weight for Retail Sale","ICON Group ","San Diego,, United States","Industry & Manufacturing","All",594,"http://www.reportbuyer.com/industry_manufacturing/textiles/world_market_cotton_yarn_least_85_cotton_weight_retail_sale.html","Published on 13-May-2010",112
"The World Market for Cotton Yarn of under 85% Cotton by Weight for Retail Sale","ICON Group ","San Diego,, United States","Industry & Manufacturing","All",594,"http://www.reportbuyer.com/industry_manufacturing/textiles/world_market_cotton_yarn_85_cotton_weight_retail_sale.html","Published on 13-May-2010",90
"The World Market for Wholesale Cotton Yarn of At Least 85% Cotton by Weight","ICON Group ","San Diego,, United States","Industry & Manufacturing","All",594,"http://www.reportbuyer.com/industry_manufacturing/textiles/world_market_wholesale_cotton_yarn_least_85_cotton_weight.html","Published on 13-May-2010",198
"The World Market for Wholesale Cotton Yarn of under 85% Cotton by Weight","ICON Group ","San Diego,, United States","Industry & Manufacturing","All",594,"http://www.reportbuyer.com/industry_manufacturing/textiles/world_market_wholesale_cotton_yarn_85_cotton_weight.html","Published on 13-May-2010",126
"The World Market for Sewing Thread Made of Manmade Fibers","ICON Group ","San Diego,, United States","Industry & Manufacturing","All",594,"http://www.reportbuyer.com/industry_manufacturing/textiles/world_market_sewing_thread_made_manmade_fibers.html","Published on 13-May-2010",178
"The World Market for Sewing Thread Made of Synthetic Filaments","ICON Group ","San Diego,, United States","Industry & Manufacturing","All",594,"http://www.reportbuyer.com/industry_manufacturing/textiles/world_market_sewing_thread_made_synthetic_filaments.html","Published on 13-May-2010",156
"The World Market for Sewing Thread Made of Artificial Filaments","ICON Group ","San Diego,, United States","Industry & Manufacturing","All",594,"http://www.reportbuyer.com/industry_manufacturing/textiles/world_market_sewing_thread_made_artificial_filaments.html","Published on 13-May-2010",97
"The World Market for Sewing Thread Made of Synthetic Staple Fibers","ICON Group ","San Diego,, United States","Industry & Manufacturing","All",594,"http://www.reportbuyer.com/industry_manufacturing/textiles/world_market_sewing_thread_made_synthetic_staple_fibers.html","Published on 13-May-2010",132
"The World Market for Sewing Thread Made of Artificial Staple Fibers","ICON Group ","San Diego,, United States","Industry & Manufacturing","All",594,"http://www.reportbuyer.com/industry_manufacturing/textiles/world_market_sewing_thread_made_artificial_staple_fibers.html","Published on 13-May-2010",65
"The World Market for Wholesale Textured Synthetic Filament Yarn Including Monofilament of Less Than 67 Decitex","ICON Group ","San Diego,, United States","Industry & Manufacturing","All",594,"http://www.reportbuyer.com/industry_manufacturing/textiles/world_market_wholesale_textured_synthetic_filament_yarn_including_monofilament_less_67_decitex.html","Published on 13-May-2010",188
"The World Market for Wholesale Synthetic Filament Yarn Made of Textured Nylon or Other Polyamides Excluding Sewing Thread","ICON Group ","San Diego,, United States","Industry & Manufacturing","All",594,"http://www.reportbuyer.com/industry_manufacturing/textiles/world_market_wholesale_synthetic_filament_yarn_made_textured_nylon_polyamides_excluding_sewing_thread.html","Published on 13-May-2010",155
"The World Market for Wholesale Synthetic Filament Yarn Made of Textured Polyesters Excluding Sewing Thread","ICON Group ","San Diego,, United States","Industry & Manufacturing","All",594,"http://www.reportbuyer.com/industry_manufacturing/textiles/world_market_wholesale_synthetic_filament_yarn_made_textured_polyesters_excluding_sewing_thread.html","Published on 13-May-2010",155
"The World Market for Synthetic Filament Yarn for Retail Sale Excluding Sewing Thread","ICON Group ","San Diego,, United States","Industry & Manufacturing","All",594,"http://www.reportbuyer.com/industry_manufacturing/textiles/world_market_synthetic_filament_yarn_retail_sale_excluding_sewing_thread.html","Published on 13-May-2010",92
"The World Market for Wholesale Synthetic Filament High-Tenacity Yarn Made of Nylon, Polyamides, or Polyesters Excluding Sewing Thread","ICON Group ","San Diego,, United States","Industry & Manufacturing","All",594,"http://www.reportbuyer.com/industry_manufacturing/textiles/world_market_wholesale_synthetic_filament_high_tenacity_yarn_made_nylon_polyamides_polyesters_excluding_sewing_thread.html","Published on 13-May-2010",169
"The World Market for Artificial Filament Yarn for Retail Sale Excluding Sewing Thread","ICON Group ","San Diego,, United States","Industry & Manufacturing","All",594,"http://www.reportbuyer.com/industry_manufacturing/textiles/world_market_artificial_filament_yarn_retail_sale_excluding_sewing_thread.html","Published on 13-May-2010",62
"The World Market for Wholesale Textured Artificial Filament Yarn Excluding Sewing Thread","ICON Group ","San Diego,, United States","Industry & Manufacturing","All",594,"http://www.reportbuyer.com/industry_manufacturing/textiles/world_market_wholesale_textured_artificial_filament_yarn_excluding_sewing_thread.html","Published on 13-May-2010",53
"The World Market for Wholesale High-Tenacity Viscose Rayon Yarn Excluding Sewing Thread","ICON Group ","San Diego,, United States","Industry & Manufacturing","All",594,"http://www.reportbuyer.com/industry_manufacturing/textiles/world_market_wholesale_high_tenacity_viscose_rayon_yarn_excluding_sewing_thread.html","Published on 13-May-2010",81
"The World Market for Artificial Monofilament of At Least 67 Decitex with Cross-Section Dimension Not Exceeding 1 mm and Artificial Textile Strip or Straw Not Exceeding 5 mm Wide","ICON Group ","San Diego,, United States","Industry & Manufacturing","All",594,"http://www.reportbuyer.com/industry_manufacturing/textiles/world_market_artificial_monofilament_least_67_decitex_cross_section_dimension_not_exceeding_mm_artificial_textile_strip_straw_not_exceeding_mm_wide.html","Published on 13-May-2010",71
"The World Market for Yarn of At Least 85% Synthetic Staple Fibers by Weight for Retail Sale Excluding Sewing Thread","ICON Group ","San Diego,, United States","Industry & Manufacturing","All",594,"http://www.reportbuyer.com/industry_manufacturing/textiles/world_market_yarn_least_85_synthetic_staple_fibers_weight_retail_sale_excluding_sewing_thread.html","Published on 13-May-2010",102
"The World Market for Wholesale Yarn of At Least 85% Synthetic Staple Fibers by Weight Excluding Sewing Thread","ICON Group ","San Diego,, United States","Industry & Manufacturing","All",594,"http://www.reportbuyer.com/industry_manufacturing/textiles/world_market_wholesale_yarn_least_85_synthetic_staple_fibers_weight_excluding_sewing_thread.html","Published on 13-May-2010",164
"The World Market for Synthetic Yarn Containing Less Than 85% Synthetic Staple Fibers by Weight for Retail Sale Excluding Sewing Thread","ICON Group ","San Diego,, United States","Industry & Manufacturing","All",594,"http://www.reportbuyer.com/industry_manufacturing/textiles/world_market_synthetic_yarn_containing_less_85_synthetic_staple_fibers_weight_retail_sale_excluding_sewing_thread.html","Published on 13-May-2010",94
"The World Market for Wholesale Synthetic Yarn Containing Less Than 85% Synthetic Staple Fibers by Weight Excluding Sewing Thread","ICON Group ","San Diego,, United States","Industry & Manufacturing","All",594,"http://www.reportbuyer.com/industry_manufacturing/textiles/world_market_wholesale_synthetic_yarn_containing_less_85_synthetic_staple_fibers_weight_excluding_sewing_thread.html","Published on 13-May-2010",169
"The World Market for Yarn Made of Artificial Staple Fibers for Retail Sale Excluding Sewing Thread","ICON Group ","San Diego,, United States","Industry & Manufacturing","All",594,"http://www.reportbuyer.com/industry_manufacturing/textiles/world_market_yarn_made_artificial_staple_fibers_retail_sale_excluding_sewing_thread.html","Published on 13-May-2010",66
"The World Market for Wholesale Yarn of At Least 85% Artificial Staple Fibers by Weight Excluding Sewing Thread","ICON Group ","San Diego,, United States","Industry & Manufacturing","All",594,"http://www.reportbuyer.com/industry_manufacturing/textiles/world_market_wholesale_yarn_least_85_artificial_staple_fibers_weight_excluding_sewing_thread.html","Published on 13-May-2010",119
"The World Market for Wholesale Yarn Containing Less Than 85% Artificial Staple Fibers by Weight Excluding Sewing Thread","ICON Group ","San Diego,, United States","Industry & Manufacturing","All",594,"http://www.reportbuyer.com/industry_manufacturing/textiles/world_market_wholesale_yarn_containing_less_85_artificial_staple_fibers_weight_excluding_sewing_thread.html","Published on 13-May-2010",118
"The World Market for Synthetic Textile Strip or Straw Not Exceeding 5 mm Wide and Synthetic Monofilament of At Least 67 Decitex and Cross-Section Dimension Not Exceeding 1 mm","ICON Group ","San Diego,, United States","Industry & Manufacturing","All",594,"http://www.reportbuyer.com/industry_manufacturing/textiles/world_market_synthetic_textile_strip_straw_not_exceeding_mm_wide_synthetic_monofilament_least_67_decitex_cross_section_dimension_not_exceeding_mm.html","Published on 13-May-2010",159
"The World Market for Metallic Textile Yarn, Strip, or Straw, Not Exceeding 5 mm Wide, and Combined with Metal Thread, Strip, or Powder or Covered with Metal","ICON Group ","San Diego,, United States","Industry & Manufacturing","All",594,"http://www.reportbuyer.com/industry_manufacturing/textiles/world_market_metallic_textile_yarn_strip_straw_not_exceeding_mm_wide_combined_metal_thread_strip_powder_covered_metal.html","Published on 13-May-2010",113
"The World Market for Wholesale Silk Yarn Excluding Yarn Spun from Silk Waste","ICON Group ","San Diego,, United States","Industry & Manufacturing","All",594,"http://www.reportbuyer.com/industry_manufacturing/textiles/world_market_wholesale_silk_yarn_excluding_yarn_spun_silk_waste.html","Published on 13-May-2010",76
"The World Market for Wholesale Silk Yarn Spun from Silk Waste","ICON Group ","San Diego,, United States","Industry & Manufacturing","All",594,"http://www.reportbuyer.com/industry_manufacturing/textiles/world_market_wholesale_silk_yarn_spun_silk_waste.html","Published on 13-May-2010",56
"The World Market for Silk Yarn for Retail Sale and Silkworm Gut","ICON Group ","San Diego,, United States","Industry & Manufacturing","All",594,"http://www.reportbuyer.com/industry_manufacturing/textiles/world_market_silk_yarn_retail_sale_silkworm_gut.html","Published on 13-May-2010",53
"The World Market for Glass Fiber Slivers, Rovings, Yarn, and Chopped Strands","ICON Group ","San Diego,, United States","Industry & Manufacturing","All",594,"http://www.reportbuyer.com/industry_manufacturing/textiles/world_market_glass_fiber_slivers_rovings_yarn_chopped_strands.html","Published on 13-May-2010",161
"The World Market for Flax Yarn","ICON Group ","San Diego,, United States","Industry & Manufacturing","All",594,"http://www.reportbuyer.com/industry_manufacturing/textiles/world_market_flax_yarn.html","Published on 13-May-2010",88
"The World Market for Yarn of Jute or Other Textile Bast Fibers Excluding Flax, True Hemp, and Ramie","ICON Group ","San Diego,, United States","Industry & Manufacturing","All",594,"http://www.reportbuyer.com/industry_manufacturing/textiles/world_market_yarn_jute_textile_bast_fibers_excluding_flax_true_hemp_ramie.html","Published on 13-May-2010",80
"The World Market for Woven Cotton Gauze, Pile, and Chenille Fabrics","ICON Group ","San Diego,, United States","Industry & Manufacturing","All",594,"http://www.reportbuyer.com/industry_manufacturing/textiles/world_market_woven_cotton_gauze_pile_chenille_fabrics.html","Published on 13-May-2010",144
"The World Market for Cotton Gauze","ICON Group ","San Diego,, United States","Industry & Manufacturing","All",594,"http://www.reportbuyer.com/industry_manufacturing/textiles/world_market_cotton_gauze.html","Published on 13-May-2010",56
"The World Market for Cotton Terry Toweling and Similar Terry Woven Fabrics","ICON Group ","San Diego,, United States","Industry & Manufacturing","All",594,"http://www.reportbuyer.com/industry_manufacturing/textiles/world_market_cotton_terry_toweling_similar_terry_woven_fabrics.html","Published on 13-May-2010",53
"The World Market for Bleached Cotton Terry Toweling and Similar Terry Woven Fabrics","ICON Group ","San Diego,, United States","Industry & Manufacturing","All",594,"http://www.reportbuyer.com/industry_manufacturing/textiles/world_market_bleached_cotton_terry_toweling_similar_terry_woven_fabrics.html","Published on 13-May-2010",86
"The World Market for Uncut Cotton Pile Woven Fabrics Excluding Terry Fabrics","ICON Group ","San Diego,, United States","Industry & Manufacturing","All",594,"http://www.reportbuyer.com/industry_manufacturing/textiles/world_market_uncut_cotton_pile_woven_fabrics_excluding_terry_fabrics.html","Published on 13-May-2010",74
"The World Market for Woven Fabrics Made of Synthetic Filament Yarn","ICON Group ","San Diego,, United States","Industry & Manufacturing","All",594,"http://www.reportbuyer.com/industry_manufacturing/textiles/world_market_woven_fabrics_made_synthetic_filament_yarn.html","Published on 13-May-2010",225
"The World Market for Woven Fabrics from High-Tenacity Nylon, Polyamide, or Polyester Yarn","ICON Group ","San Diego,, United States","Industry & Manufacturing","All",594,"http://www.reportbuyer.com/industry_manufacturing/textiles/world_market_woven_fabrics_high_tenacity_nylon_polyamide_polyester_yarn.html","Published on 13-May-2010",153
"The World Market for Woven Fabrics from Strip or Straw of Synthetic Textile Materials","ICON Group ","San Diego,, United States","Industry & Manufacturing","All",594,"http://www.reportbuyer.com/industry_manufacturing/textiles/world_market_woven_fabrics_strip_straw_synthetic_textile_materials.html","Published on 13-May-2010",140
"The World Market for Fabrics of Layers of Parallel Synthetic Filament Yarns, Superimposed on Each Other at Acute or Right Angles with Their Layers Bonded","ICON Group ","San Diego,, United States","Industry & Manufacturing","All",594,"http://www.reportbuyer.com/industry_manufacturing/textiles/world_market_fabrics_layers_parallel_synthetic_filament_yarns_superimposed_acute_right_angles_layers_bonded.html","Published on 13-May-2010",81
"The World Market for Woven Fabrics of At Least 85% Synthetic Staple Fibers by Weight","ICON Group ","San Diego,, United States","Industry & Manufacturing","All",594,"http://www.reportbuyer.com/industry_manufacturing/textiles/world_market_woven_fabrics_least_85_synthetic_staple_fibers_weight.html","Published on 13-May-2010",193
"The World Market for Woven Fabrics of At Least 85% Polyester Staple Fibers by Weight","ICON Group ","San Diego,, United States","Industry & Manufacturing","All",594,"http://www.reportbuyer.com/industry_manufacturing/textiles/world_market_woven_fabrics_least_85_polyester_staple_fibers_weight.html","Published on 13-May-2010",182
"The World Market for Woven Fabrics of at least 85% Acrylic or Modacrylic Staple Fibers by Weight","ICON Group ","San Diego,, United States","Industry & Manufacturing","All",594,"http://www.reportbuyer.com/industry_manufacturing/textiles/world_market_woven_fabrics_least_85_acrylic_modacrylic_staple_fibers_weight.html","Published on 13-May-2010",117
"The World Market for Woven Fabrics of Less Than 85% Synthetic Staple Fibers by Weight, Mixed Mainly with Cotton","ICON Group ","San Diego,, United States","Industry & Manufacturing","All",594,"http://www.reportbuyer.com/industry_manufacturing/textiles/world_market_woven_fabrics_less_85_synthetic_staple_fibers_weight_mixed_mainly_cotton.html","Published on 13-May-2010",204
