"Other Communications Equipment Manufacturing in the US","IBISWorld","Jersey City, United States","Telecoms","United States",751,"http://www.reportbuyer.com/telecoms/telecoms_equipment/communications_equipment_manufacturing_us.html","Published on 21-Jan-2008",44
"Household Appliance Manufacturing in Australia","IBISWorld","Jersey City, United States","Consumer Goods & Retail","Australia",829,"http://www.reportbuyer.com/consumer_goods_retail/appliances/household_appliance_manufacturing_australia.html","Published on 08-Aug-2011",39
"Other Electronic Component Manufacturing in the US","IBISWorld","Jersey City, United States","Computing & Electronics","United States",751,"http://www.reportbuyer.com/computing_electronics/electrical_components/electronic_component_manufacturing_us.html","Published on 10-Jan-2008",51
"Navigational, Measuring, Electromedical and Control Instruments Manufacturing in the US","IBISWorld","Jersey City, United States","Computing & Electronics","United States",751,"http://www.reportbuyer.com/computing_electronics/electrical_components/navigational_measuring_electromedical_control_instruments_manufacturing_us.html","Published on 30-Jan-2008",51
"Manufacturing and Reproducing Magnetic and Optical Media in the US","IBISWorld","Jersey City, United States","Computing & Electronics","United States",751,"http://www.reportbuyer.com/computing_electronics/electrical_components/manufacturing_reproducing_magnetic_optical_media_us.html","Published on 17-Oct-2007",34
"Electric Lamp Bulb and Part Manufacturing in the US","IBISWorld","Jersey City, United States","Computing & Electronics","United States",751,"http://www.reportbuyer.com/computing_electronics/manufacturing/electric_lamp_bulb_part_manufacturing_us.html","Published on 06-Jul-2007",38
"Lighting Fixture Manufacturing in the US","IBISWorld","Jersey City, United States","Industry & Manufacturing","United States",751,"http://www.reportbuyer.com/industry_manufacturing/lighting/lighting_fixture_manufacturing_us.html","Published on 05-Nov-2007",40
"Household Electrical Appliance Retailers in China","IBISWorld","Jersey City, United States","Consumer Goods & Retail","China",821,"http://www.reportbuyer.com/consumer_goods_retail/appliances/household_electrical_appliance_retailers_china.html","Published on 10-Oct-2010",35
"Major Appliance Manufacturing in the US","IBISWorld","Jersey City, United States","Consumer Goods & Retail","United States",751,"http://www.reportbuyer.com/consumer_goods_retail/appliances/major_appliance_manufacturing_us_1.html","Published on 30-Jan-2008",49
"Electronic Transmission Equipment Manufacturing in China","IBISWorld","Jersey City, United States","Computing & Electronics","China",821,"http://www.reportbuyer.com/computing_electronics/manufacturing/electronic_transmission_equipment_manufacturing_china.html","Published on 04-Apr-2011",40
"Wiring Device Manufacturing in the US","IBISWorld","Jersey City, United States","Industry & Manufacturing","United States",821,"http://www.reportbuyer.com/industry_manufacturing/wire_cable/wiring_device_manufacturing_us.html","Published on 09-Sep-2011",33
"All Other Electrical Equipment and Component Manufacturing in the US","IBISWorld","Jersey City, United States","Computing & Electronics","United States",751,"http://www.reportbuyer.com/computing_electronics/manufacturing/electrical_equipment_component_manufacturing_us.html","Published on 20-Sep-2007",42
"Automobile Manufacturing in the US","IBISWorld","Jersey City, United States","Automotive","United States",751,"http://www.reportbuyer.com/automotive/manufacturing_automotive/automobile_manufacturing_us.html","Published on 28-Nov-2007",40
"Light Truck &amp; Sport Utility Vehicle Manufacturing in the US","IBISWorld","Jersey City, United States","Automotive","United States",821,"http://www.reportbuyer.com/automotive/trucks/light_truck_utility_vehicle_manufacturing_us.html","Published on 03-Mar-2011",36
"Heavy Duty Truck Manufacturing in the US","IBISWorld","Jersey City, United States","Automotive","United States",751,"http://www.reportbuyer.com/automotive/trucks/heavy_duty_truck_manufacturing_us.html","Published on 05-Feb-2008",36
"Telecommunications and Other Electrical and Electronic Equipment Wholesaling in Australia","IBISWorld","Jersey City, United States","Automotive","Australia",907,"http://www.reportbuyer.com/automotive/components/telecommunications_electrical_electronic_equipment_wholesaling_australia.html","Published on 06-Jun-2011",41
"Multi-Unit Apartment and Townhouse Construction in Australia","IBISWorld","Jersey City, United States","Industry & Manufacturing","Australia",829,"http://www.reportbuyer.com/industry_manufacturing/construction/residential/multi_unit_apartment_townhouse_construction_australia.html","Published on 09-Sep-2011",41
"Houseware and Gardenware Wholesaling in Australia","IBISWorld","Jersey City, United States","Consumer Goods & Retail","Australia",845,"http://www.reportbuyer.com/consumer_goods_retail/home_garden/houseware_gardenware_wholesaling_australia.html","Published on 01-Jan-2011",33
"Motor Vehicle Transmission and Power Train Parts Manufacturing in the US","IBISWorld","Jersey City, United States","Automotive","United States",751,"http://www.reportbuyer.com/automotive/components/motor_vehicle_transmission_power_train_parts_manufacturing_us.html","Published on 28-Nov-2007",38
"Motor Vehicle Seating and Interior Trim Manufacturing in the US","IBISWorld","Jersey City, United States","Automotive","United States",751,"http://www.reportbuyer.com/automotive/components/motor_vehicle_seating_interior_trim_manufacturing_us.html","Published on 04-Dec-2007",36
"Other Motor Vehicle Parts Manufacturing in the US","IBISWorld","Jersey City, United States","Automotive","United States",751,"http://www.reportbuyer.com/automotive/components/motor_vehicle_parts_manufacturing_us.html","Published on 12-Dec-2007",42
"Aerospace Product and Parts Manufacturing in the US","IBISWorld","Jersey City, United States","Industry & Manufacturing","United States",751,"http://www.reportbuyer.com/industry_manufacturing/aerospace/aerospace_product_parts_manufacturing_us.html","Published on 29-Jun-2006",33
"Aircraft Product and Parts Manufacturing in the US","IBISWorld","Jersey City, United States","Industry & Manufacturing","United States",751,"http://www.reportbuyer.com/industry_manufacturing/aerospace/aircraft_manufacturing/aircraft_product_parts_manufacturing_us.html","Published on 04-Dec-2007",54
"Railroad Rolling Stock Manufacturing in the US","IBISWorld","Jersey City, United States","Transport & Travel","United States",751,"http://www.reportbuyer.com/transport_travel/railway/railroad_rolling_stock_manufacturing_us.html","Published on 31-Dec-2007",49
"Ship Building and Repairing in the US","IBISWorld","Jersey City, United States","Transport & Travel","United States",751,"http://www.reportbuyer.com/transport_travel/maritime/ship_building_repairing_us.html","Published on 23-Oct-2007",48
"Other Transportation Equipment Manufacturing in the US","IBISWorld","Jersey City, United States","Transport & Travel","United States",751,"http://www.reportbuyer.com/transport_travel/country_overviews_transport_travel/transportation_equipment_manufacturing_us.html","Published on 30-Mar-2006",41
"Jewellery &amp; Related Article Manufacturing in the UK","IBISWorld","Jersey City, United States","Consumer Goods & Retail","United Kingdom",782,"http://www.reportbuyer.com/consumer_goods_retail/jewellery_watches/jewellery_related_article_manufacturing_uk.html","Published on 09-Sep-2011",24
"Paper &amp; Paperboard Manufacturing in the UK","IBISWorld","Jersey City, United States","Industry & Manufacturing","United Kingdom",782,"http://www.reportbuyer.com/industry_manufacturing/pulp_paper/paper_paperboard_manufacturing_uk.html","Published on 08-Aug-2011",31
"Wood Kitchen Cabinet and Countertop Manufacturing in the US","IBISWorld","Jersey City, United States","Industry & Manufacturing","United States",751,"http://www.reportbuyer.com/industry_manufacturing/construction/residential/wood_kitchen_cabinet_countertop_manufacturing_us.html","Published on 08-Jan-2008",40
"Mattress Manufacturing in the US","IBISWorld","Jersey City, United States","Consumer Goods & Retail","United States",821,"http://www.reportbuyer.com/consumer_goods_retail/home_garden/mattress_manufacturing_us.html","Published on 06-Jun-2011",39
"Blind &amp; Shade Manufacturing in the US","IBISWorld","Jersey City, United States","Consumer Goods & Retail","United States",821,"http://www.reportbuyer.com/consumer_goods_retail/home_garden/blind_shade_manufacturing_us_1.html","Published on 04-Apr-2011",34
"Women's &amp; Girls' Apparel Manufacturing in the US","IBISWorld","Jersey City, United States","Consumer Goods & Retail","United States",821,"http://www.reportbuyer.com/consumer_goods_retail/clothing/womens_girls_apparel_manufacturing_us.html","Published on 08-Aug-2011",37
"Surgical and Medical Instrument and Appliance Manufacturing in the US","IBISWorld","Jersey City, United States","Pharma &amp; Healthcare","United States",751,"http://www.reportbuyer.com/pharma_healthcare/medical_devices/surgical_medical_instrument_appliance_manufacturing_us.html","Published on 24-Dec-2007",45
"Ophthalmic Goods Manufacturing in the US","IBISWorld","Jersey City, United States","Consumer Goods & Retail","United States",751,"http://www.reportbuyer.com/consumer_goods_retail/clothing/eyewear/ophthalmic_goods_manufacturing_us.html","Published on 18-Dec-2007",31
"Jewelry and Silverware Manufacturing in the US","IBISWorld","Jersey City, United States","Consumer Goods & Retail","United States",751,"http://www.reportbuyer.com/consumer_goods_retail/jewellery_watches/jewelry_silverware_manufacturing_us.html","Published on 08-Aug-2007",41
"Office Supplies (except Paper) Manufacturing in the US","IBISWorld","Jersey City, United States","Business &amp; Government","United States",751,"http://www.reportbuyer.com/business_government/office_equipment/office_supplies_except_paper_manufacturing_us.html","Published on 31-Dec-2007",41
"Sign Manufacturing in the US","IBISWorld","Jersey City, United States","Computing & Electronics","United States",751,"http://www.reportbuyer.com/computing_electronics/electrical_products/sign_manufacturing_us_1.html","Published on 23-Jan-2008",43
"All Other Miscellaneous Manufacturing in the US","IBISWorld","Jersey City, United States","Industry & Manufacturing","United States",751,"http://www.reportbuyer.com/industry_manufacturing/machinery/industrial_machinery/miscellaneous_manufacturing_us.html","Published on 17-Aug-2007",45
"Automobile and Other Motor Vehicle Wholesalers in the US","IBISWorld","Jersey City, United States","Automotive","United States",751,"http://www.reportbuyer.com/automotive/sales_dealers/automobile_motor_vehicle_wholesalers_us.html","Published on 29-Nov-2007",44
"Motor Vehicle Supplies and New Parts Wholesalers in the US","IBISWorld","Jersey City, United States","Automotive","United States",751,"http://www.reportbuyer.com/automotive/aftermarket/motor_vehicle_supplies_new_parts_wholesalers_us.html","Published on 04-Dec-2007",39
"Tire and Tube Wholesalers in the US","IBISWorld","Jersey City, United States","Automotive","United States",751,"http://www.reportbuyer.com/automotive/tyres/tire_tube_wholesalers_us.html","Published on 18-Sep-2007",41
"Motor Vehicle Parts (Used) Wholesalers in the US","IBISWorld","Jersey City, United States","Automotive","United States",751,"http://www.reportbuyer.com/automotive/components/motor_vehicle_parts_used_wholesalers_us.html","Published on 08-Oct-2007",33
"Furniture Wholesalers in the US","IBISWorld","Jersey City, United States","Consumer Goods & Retail","United States",751,"http://www.reportbuyer.com/consumer_goods_retail/home_garden/furniture/furniture_wholesalers_us.html","Published on 17-Dec-2007",53
"Home Furnishing Wholesalers in the US","IBISWorld","Jersey City, United States","Consumer Goods & Retail","United States",751,"http://www.reportbuyer.com/consumer_goods_retail/home_garden/furniture/home_furnishing_wholesalers_us.html","Published on 09-Sep-2007",37
"Lumber, Plywood, Millwork and Wood Panel Wholesalers in the US","IBISWorld","Jersey City, United States","Industry & Manufacturing","United States",751,"http://www.reportbuyer.com/industry_manufacturing/wood/lumber_plywood_millwork_wood_panel_wholesalers_us.html","Published on 24-Dec-2007",46
"Stone, Concrete &amp; Clay Wholesaling in the US","IBISWorld","Jersey City, United States","Industry & Manufacturing","United States",821,"http://www.reportbuyer.com/industry_manufacturing/construction/construction_materials/brick_stone_related_construction_material_wholesalers_us.html","Published on 05-May-2011",32
"Roofing, Siding and Insulation Material Wholesalers in the US","IBISWorld","Jersey City, United States","Industry & Manufacturing","United States",751,"http://www.reportbuyer.com/industry_manufacturing/construction/construction_materials/roofing_siding_insulation_material_wholesalers_us.html","Published on 18-Sep-2007",37
"Other Construction Material Wholesalers in the US","IBISWorld","Jersey City, United States","Industry & Manufacturing","United States",751,"http://www.reportbuyer.com/industry_manufacturing/construction/construction_materials/construction_material_wholesalers_us.html","Published on 11-Sep-2007",41
"Photographic Equipment and Supplies Wholesalers in the US","IBISWorld","Jersey City, United States","Business &amp; Government","United States",751,"http://www.reportbuyer.com/business_government/design_photography/photographic_equipment_supplies_wholesalers_us.html","Published on 29-Nov-2007",37
"Office Equipment Wholesalers in the US","IBISWorld","Jersey City, United States","Business &amp; Government","United States",751,"http://www.reportbuyer.com/business_government/office_equipment/office_equipment_wholesalers_us.html","Published on 11-Oct-2007",38
"Computer and Computer Peripheral Equipment and Software Wholesalers in the US","IBISWorld","Jersey City, United States","Computing & Electronics","United States",751,"http://www.reportbuyer.com/computing_electronics/computer_products_distribution_support/computer_computer_peripheral_equipment_software_wholesalers_us.html","Published on 30-Jan-2008",58
"Other Commercial Equipment Wholesalers in the US","IBISWorld","Jersey City, United States","Industry & Manufacturing","United States",751,"http://www.reportbuyer.com/industry_manufacturing/machinery/industrial_machinery/commercial_equipment_wholesalers_us.html","Published on 05-Nov-2007",37
"Medical, Dental and Hospital Equipment and Supplies Wholesalers in the US","IBISWorld","Jersey City, United States","Pharma &amp; Healthcare","United States",751,"http://www.reportbuyer.com/pharma_healthcare/dental/medical_dental_hospital_equipment_supplies_wholesalers_us.html","Published on 24-Oct-2007",42
"Ophthalmic Goods Wholesalers in the US","IBISWorld","Jersey City, United States","Consumer Goods & Retail","United States",751,"http://www.reportbuyer.com/consumer_goods_retail/clothing/eyewear/ophthalmic_goods_wholesalers_us.html","Published on 29-Nov-2007",35
"Other Professional Equipment and Supplies Wholesalers in the US","IBISWorld","Jersey City, United States","Industry & Manufacturing","United States",751,"http://www.reportbuyer.com/industry_manufacturing/machinery/industrial_machinery/professional_equipment_supplies_wholesalers_us.html","Published on 15-Aug-2007",38
"Metal Service Centers and Offices in the US","IBISWorld","Jersey City, United States","Industry & Manufacturing","United States",751,"http://www.reportbuyer.com/industry_manufacturing/metals/metal_service_centers_offices_us.html","Published on 30-Jan-2008",42
"Coal and Other Mineral and Ore Wholesalers in the US","IBISWorld","Jersey City, United States","Energy & Utilities","United States",751,"http://www.reportbuyer.com/energy_utilities/coal/coal_mineral_ore_wholesalers_us.html","Published on 20-Apr-2007",35
"Electrical Apparatus and Equipment, Wiring Supplies and Construction Material Wholesalers in the US","IBISWorld","Jersey City, United States","Computing & Electronics","United States",751,"http://www.reportbuyer.com/computing_electronics/electrical_products/electrical_apparatus_equipment_wiring_supplies_construction_material_wholesalers_us.html","Published on 20-Aug-2007",37
"Electrical Appliance, Television and Radio Set Wholesalers in the US","IBISWorld","Jersey City, United States","Computing & Electronics","United States",751,"http://www.reportbuyer.com/computing_electronics/electrical_products/electrical_appliance_television_radio_set_wholesalers_us.html","Published on 29-Aug-2007",41
"Other Electronic Parts and Equipment Wholesalers in the US","IBISWorld","Jersey City, United States","Computing & Electronics","United States",751,"http://www.reportbuyer.com/computing_electronics/electrical_components/electronic_parts_equipment_wholesalers_us.html","Published on 30-Aug-2007",37
"Hardware Wholesalers in the US","IBISWorld","Jersey City, United States","Consumer Goods & Retail","United States",751,"http://www.reportbuyer.com/consumer_goods_retail/home_garden/home_improvement_diy/hardware_wholesalers_us.html","Published on 15-Aug-2007",43
"Warm Air Heating and Air-Conditioning Equipment and Supplies Wholesalers in the US","IBISWorld","Jersey City, United States","Industry & Manufacturing","United States",751,"http://www.reportbuyer.com/industry_manufacturing/machinery/industrial_machinery/warm_air_heating_air_conditioning_equipment_supplies_wholesalers_us.html","Published on 25-May-2007",43
"Refrigeration Equipment and Supplies Wholesalers in the US","IBISWorld","Jersey City, United States","Industry & Manufacturing","United States",751,"http://www.reportbuyer.com/industry_manufacturing/machinery/industrial_machinery/refrigeration_equipment_supplies_wholesalers_us.html","Published on 25-May-2007",44
"Construction and Mining (except Oil Well) Machinery and Equipment Wholesalers in the US","IBISWorld","Jersey City, United States","Industry & Manufacturing","United States",751,"http://www.reportbuyer.com/industry_manufacturing/construction/construction_equipment/construction_mining_except_oil_well_machinery_equipment_wholesalers_us.html","Published on 29-Aug-2007",51
"Farm and Garden Machinery and Equipment Wholesalers in the US","IBISWorld","Jersey City, United States","Industry & Manufacturing","United States",751,"http://www.reportbuyer.com/industry_manufacturing/agriculture/agricultural_machinery/farm_garden_machinery_equipment_wholesalers_us.html","Published on 09-Oct-2007",38
"Industrial Machinery and Equipment Wholesalers in the US","IBISWorld","Jersey City, United States","Industry & Manufacturing","United States",751,"http://www.reportbuyer.com/industry_manufacturing/machinery/industrial_machinery/industrial_machinery_equipment_wholesalers_us.html","Published on 02-Apr-2007",36
"Industrial Supplies Wholesalers in the US","IBISWorld","Jersey City, United States","Industry & Manufacturing","United States",751,"http://www.reportbuyer.com/industry_manufacturing/machinery/industrial_machinery/industrial_supplies_wholesalers_us.html","Published on 10-Jan-2008",46
"Service Establishment Equipment &amp; Supplies Wholesaling in the US","IBISWorld","Jersey City, United States","Industry & Manufacturing","United States",751,"http://www.reportbuyer.com/industry_manufacturing/machinery/industrial_machinery/service_establishment_equipment_supplies_wholesaling_us.html","Published on 02-Feb-2009",33
"Transportation Equipment and Supplies (except Motor Vehicle) Wholesalers in the US","IBISWorld","Jersey City, United States","Transport & Travel","United States",751,"http://www.reportbuyer.com/transport_travel/country_overviews_transport_travel/transportation_equipment_supplies_except_motor_vehicle_wholesalers_us.html","Published on 27-Sep-2007",54
"Sporting and Recreational Goods and Supplies Wholesalers in the US","IBISWorld","Jersey City, United States","Consumer Goods & Retail","United States",751,"http://www.reportbuyer.com/consumer_goods_retail/sports_recreation/sporting_recreational_goods_supplies_wholesalers_us.html","Published on 05-Mar-2007",38
"Toy and Hobby Goods and Supplies Wholesalers in the US","IBISWorld","Jersey City, United States","Consumer Goods & Retail","United States",751,"http://www.reportbuyer.com/consumer_goods_retail/toys_games/toy_hobby_goods_supplies_wholesalers_us.html","Published on 16-May-2007",39
"Recyclable Material Wholesalers in the US","IBISWorld","Jersey City, United States","Industry & Manufacturing","United States",751,"http://www.reportbuyer.com/industry_manufacturing/environmental_services/recyclable_material_wholesalers_us.html","Published on 15-Jan-2008",40
"Jewelry &amp; Watch Wholesaling in the US","IBISWorld","Jersey City, United States","Consumer Goods & Retail","United States",821,"http://www.reportbuyer.com/consumer_goods_retail/jewellery_watches/jewelry_watch_precious_stone_precious_metal_wholesalers_us.html","Published on 04-Apr-2011",30
"Other Miscellaneous Durable Goods Wholesalers in the US","IBISWorld","Jersey City, United States","Consumer Goods & Retail","United States",751,"http://www.reportbuyer.com/consumer_goods_retail/misc_consumer_goods_retail/miscellaneous_durable_goods_wholesalers_us.html","Published on 23-May-2007",35
"Printing and Writing Paper Wholesalers in the US","IBISWorld","Jersey City, United States","Industry & Manufacturing","United States",751,"http://www.reportbuyer.com/industry_manufacturing/pulp_paper/printing_writing_paper_wholesalers_us.html","Published on 10-Jan-2008",40
"Stationery and Office Supplies Wholesalers in the US","IBISWorld","Jersey City, United States","Industry & Manufacturing","United States",751,"http://www.reportbuyer.com/industry_manufacturing/pulp_paper/stationery_office_supplies_wholesalers_us.html","Published on 10-Jan-2008",41
"Industrial and Personal Service Paper Wholesalers in the US","IBISWorld","Jersey City, United States","Industry & Manufacturing","United States",751,"http://www.reportbuyer.com/industry_manufacturing/pulp_paper/industrial_personal_service_paper_wholesalers_us.html","Published on 15-Aug-2007",40
"Drugs and Druggists' Sundries Wholesalers in the US","IBISWorld","Jersey City, United States","Pharma &amp; Healthcare","United States",751,"http://www.reportbuyer.com/pharma_healthcare/general_industry/drugs_druggists_sundries_wholesalers_us.html","Published on 05-Nov-2007",42
"Piece Goods, Notions and Other Dry Goods Wholesalers in the US","IBISWorld","Jersey City, United States","Consumer Goods & Retail","United States",751,"http://www.reportbuyer.com/consumer_goods_retail/misc_consumer_goods_retail/piece_goods_notions_dry_goods_wholesalers_us.html","Published on 15-Aug-2007",31
"Men's and Boys' Clothing and Furnishings Wholesalers in the US","IBISWorld","Jersey City, United States","Consumer Goods & Retail","United States",751,"http://www.reportbuyer.com/consumer_goods_retail/clothing/mens/mens_boys_clothing_furnishings_wholesalers_us.html","Published on 28-Nov-2007",38
"Women's, Children's and Infants' Clothing and Accessories Wholesalers in the US","IBISWorld","Jersey City, United States","Consumer Goods & Retail","United States",751,"http://www.reportbuyer.com/consumer_goods_retail/clothing/womens/womens_childrens_infants_clothing_accessories_wholesalers_us.html","Published on 17-Oct-2007",36
"Footwear Wholesalers in the US","IBISWorld","Jersey City, United States","Consumer Goods & Retail","United States",751,"http://www.reportbuyer.com/consumer_goods_retail/clothing/footwear/footwear_wholesalers_us.html","Published on 27-Sep-2007",37
"General Line Grocery Wholesalers in the US","IBISWorld","Jersey City, United States","Consumer Goods & Retail","United States",751,"http://www.reportbuyer.com/consumer_goods_retail/food_retailing/grocery/general_line_grocery_wholesalers_us.html","Published on 18-Oct-2007",37
"Packaged Frozen Food Wholesalers in the US","IBISWorld","Jersey City, United States","Food & Drink","United States",751,"http://www.reportbuyer.com/food_drink/chilled_frozen_food/packaged_frozen_food_wholesalers_us.html","Published on 08-Jan-2008",37
"Dairy Product (except Dried or Canned) Wholesalers in the US","IBISWorld","Jersey City, United States","Food & Drink","United States",751,"http://www.reportbuyer.com/food_drink/dairy/dairy_product_except_dried_canned_wholesalers_us.html","Published on 12-Dec-2007",33
"Poultry and Poultry Product Wholesalers in the US","IBISWorld","Jersey City, United States","Food & Drink","United States",751,"http://www.reportbuyer.com/food_drink/meat_poultry/poultry_poultry_product_wholesalers_us.html","Published on 09-Jan-2007",31
"Confectionery Wholesalers in the US","IBISWorld","Jersey City, United States","Food & Drink","United States",751,"http://www.reportbuyer.com/food_drink/confectionery/confectionery_wholesalers_us.html","Published on 18-Dec-2007",39
"Fish and Seafood Wholesalers in the US","IBISWorld","Jersey City, United States","Food & Drink","United States",751,"http://www.reportbuyer.com/food_drink/fish_seafood/fish_seafood_wholesalers_us.html","Published on 18-Dec-2007",38
"Meat and Meat Product Wholesalers in the US","IBISWorld","Jersey City, United States","Food & Drink","United States",751,"http://www.reportbuyer.com/food_drink/meat_poultry/meat_meat_product_wholesalers_us.html","Published on 17-Oct-2007",37
"Fresh Fruit and Vegetable Wholesalers in the US","IBISWorld","Jersey City, United States","Food & Drink","United States",751,"http://www.reportbuyer.com/food_drink/fruit_vegetable/fresh_fruit_vegetable_wholesalers_us.html","Published on 06-Feb-2007",35
