"The World Market for Lead Waste and Scrap","ICON Group ","San Diego,, United States","Industry & Manufacturing","All",594,"http://www.reportbuyer.com/industry_manufacturing/metals/precious_metals/world_market_lead_waste_scrap.html","Published on 13-May-2010",87
"The World Market for Zinc Waste and Scrap Excluding Zinc Dust","ICON Group ","San Diego,, United States","Industry & Manufacturing","All",594,"http://www.reportbuyer.com/industry_manufacturing/metals/precious_metals/world_market_zinc_waste_scrap_excluding_zinc_dust.html","Published on 13-May-2010",86
"The World Market for Tin Waste and Scrap","ICON Group ","San Diego,, United States","Industry & Manufacturing","All",594,"http://www.reportbuyer.com/industry_manufacturing/metals/precious_metals/world_market_tin_waste_scrap.html","Published on 13-May-2010",49
"The World Market for Ores and Concentrates of Precious Metals","ICON Group ","San Diego,, United States","Industry & Manufacturing","All",594,"http://www.reportbuyer.com/industry_manufacturing/metals/precious_metals/world_market_ores_concentrates_precious_metals.html","Published on 13-May-2010",59
"The World Market for Silver Ores and Concentrates","ICON Group ","San Diego,, United States","Industry & Manufacturing","All",594,"http://www.reportbuyer.com/industry_manufacturing/metals/precious_metals/world_market_silver_ores_concentrates.html","Published on 13-May-2010",40
"The World Market for Ores and Concentrates of Precious Metals Excluding Silver Ores and Concentrates","ICON Group ","San Diego,, United States","Industry & Manufacturing","All",594,"http://www.reportbuyer.com/industry_manufacturing/metals/precious_metals/world_market_ores_concentrates_precious_metals_excluding_silver_ores_concentrates.html","Published on 13-May-2010",56
"The World Market for Waste and Scrap of Precious Metal or of Metal Clad with Precious Metal Excluding Gold Clad and Gold Waste and Scrap","ICON Group ","San Diego,, United States","Industry & Manufacturing","All",594,"http://www.reportbuyer.com/industry_manufacturing/metals/precious_metals/world_market_waste_scrap_precious_metal_metal_clad_precious_metal_excluding_gold_clad_gold_waste_scrap.html","Published on 13-May-2010",116
"The World Market for Waste and Scrap of Platinum and Metal Clad with Platinum Excluding Sweepings Containing Other Precious Metals","ICON Group ","San Diego,, United States","Industry & Manufacturing","All",594,"http://www.reportbuyer.com/industry_manufacturing/metals/precious_metals/world_market_waste_scrap_platinum_metal_clad_platinum_excluding_sweepings_containing_precious_metals.html","Published on 13-May-2010",81
"The World Market for Bones, Horns, Ivory, Hooves, Claws, Coral, and Shells","ICON Group ","San Diego,, United States","Industry & Manufacturing","All",594,"http://www.reportbuyer.com/industry_manufacturing/agriculture/animal/world_market_bones_horns_ivory_hooves_claws_coral_shells.html","Published on 13-May-2010",118
"The World Market for Unworked Bones and Horn-Cores Including Powder and Wastes Thereof","ICON Group ","San Diego,, United States","Industry & Manufacturing","All",594,"http://www.reportbuyer.com/industry_manufacturing/agriculture/animal/world_market_unworked_bones_horn_cores_including_powder_wastes_thereof.html","Published on 13-May-2010",68
"The World Market for Unworked Coral, Shells, and Cuttle-Bone  Including Powder and Wastes Thereof","ICON Group ","San Diego,, United States","Industry & Manufacturing","All",594,"http://www.reportbuyer.com/industry_manufacturing/agriculture/animal/world_market_unworked_coral_shells_cuttle_bone_including_powder_wastes_thereof.html","Published on 13-May-2010",98
"The World Market for Unworked Ivory, Tortoise-Shell, Whalebone, Whalebone Hair, Horns, Antlers, Hooves, Nails, and Claws  Including Powder and Wastes Thereof","ICON Group ","San Diego,, United States","Industry & Manufacturing","All",594,"http://www.reportbuyer.com/industry_manufacturing/agriculture/animal/world_market_unworked_ivory_tortoise_shell_whalebone_whalebone_hair_horns_antlers_hooves_nails_claws_including_powder_wastes_thereof.html","Published on 13-May-2010",77
"The World Market for Unworked Human Hair and Human Hair Waste","ICON Group ","San Diego,, United States","Industry & Manufacturing","All",594,"http://www.reportbuyer.com/industry_manufacturing/materials/world_market_unworked_human_hair_human_hair_waste.html","Published on 13-May-2010",43
"The World Market for Pig, Hog, or Boar Bristles and Hair, Badger and Other Brush-Making Hair, and Waste of Such Bristles or Hair","ICON Group ","San Diego,, United States","Industry & Manufacturing","All",594,"http://www.reportbuyer.com/industry_manufacturing/agriculture/animal/world_market_pig_hog_boar_bristles_hair_badger_brush_making_hair_waste_bristles_hair.html","Published on 13-May-2010",63
"The World Market for Guts, Bladders, and Stomachs of Animals Excluding Fish","ICON Group ","San Diego,, United States","Industry & Manufacturing","All",594,"http://www.reportbuyer.com/industry_manufacturing/agriculture/animal/world_market_guts_bladders_stomachs_animals_excluding_fish.html","Published on 13-May-2010",130
"The World Market for Bovine Semen","ICON Group ","San Diego,, United States","Industry & Manufacturing","All",594,"http://www.reportbuyer.com/industry_manufacturing/agriculture/animal/world_market_bovine_semen.html","Published on 13-May-2010",76
"The World Market for Cleaned or Treated Bird Skins, Feathers, and Down Including Powder and Wastes Thereof","ICON Group ","San Diego,, United States","Industry & Manufacturing","All",594,"http://www.reportbuyer.com/industry_manufacturing/agriculture/animal/world_market_cleaned_treated_bird_skins_feathers_down_including_powder_wastes_thereof.html","Published on 13-May-2010",94
"The World Market for Products of Fish, Crustacean, Mollusk, or Aquatic Invertebrate Products That Are Unfit for Human Consumption","ICON Group ","San Diego,, United States","Industry & Manufacturing","All",594,"http://www.reportbuyer.com/industry_manufacturing/agriculture/animal/world_market_products_fish_crustacean_mollusk_aquatic_invertebrate_products_unfit_human_consumption.html","Published on 13-May-2010",119
"The World Market for Natural Sponges of Animal Origin","ICON Group ","San Diego,, United States","Industry & Manufacturing","All",594,"http://www.reportbuyer.com/industry_manufacturing/agriculture/animal/world_market_natural_sponges_animal_origin.html","Published on 13-May-2010",18
"The World Market for Ambergris, Castoreum, Civit, Musk, Cantharides, Bile, Glands, and Other Animal Products Used in the Preparation of Pharmaceutical Products","ICON Group ","San Diego,, United States","Pharma &amp; Healthcare","All",594,"http://www.reportbuyer.com/pharma_healthcare/animal_veterinary/world_market_ambergris_castoreum_civit_musk_cantharides_bile_glands_animal_products_used_preparation_pharmaceutical_products.html","Published on 13-May-2010",84
"The World Market for Lac; Natural Gums, Resins, Gum Resins, and Balsams","ICON Group ","San Diego,, United States","Chemicals","All",594,"http://www.reportbuyer.com/chemicals/substances/world_market_lac_natural_gums_resins_gum_resins_balsams.html","Published on 13-May-2010",136
"The World Market for Lac","ICON Group ","San Diego,, United States","Chemicals","All",594,"http://www.reportbuyer.com/chemicals/substances/world_market_lac.html","Published on 13-May-2010",34
"The World Market for Gum Arabic","ICON Group ","San Diego,, United States","Chemicals","All",594,"http://www.reportbuyer.com/chemicals/substances/world_market_gum_arabic.html","Published on 13-May-2010",74
"The World Market for Vegetable Materials Used Primarily for Plaiting Including Bamboo, Rattan, Reeds, Rushes, Oster, Raffia, Prepared Cereal Straw, and Lime Bark","ICON Group ","San Diego,, United States","Industry & Manufacturing","All",594,"http://www.reportbuyer.com/industry_manufacturing/materials/world_market_vegetable_materials_used_primarily_plaiting_including_bamboo_rattan_reeds_rushes_oster_raffia_prepared_cereal_straw_lime_bark.html","Published on 13-May-2010",110
"The World Market for Bamboos","ICON Group ","San Diego,, United States","Industry & Manufacturing","All",594,"http://www.reportbuyer.com/industry_manufacturing/materials/world_market_bamboos.html","Published on 13-May-2010",60
"The World Market for Rattans","ICON Group ","San Diego,, United States","Industry & Manufacturing","All",594,"http://www.reportbuyer.com/industry_manufacturing/materials/world_market_rattans.html","Published on 13-May-2010",46
"The World Market for Vegetable Materials Used Primarily for Plaiting Excluding Bamboos and Rattans","ICON Group ","San Diego,, United States","Industry & Manufacturing","All",594,"http://www.reportbuyer.com/industry_manufacturing/materials/world_market_vegetable_materials_used_primarily_plaiting_excluding_bamboos_rattans.html","Published on 13-May-2010",67
"The World Market for Plants and Plants Parts Used Primarily in the Preparation of Perfumes, Pharmaceuticals, Insecticides, and Fungicides","ICON Group ","San Diego,, United States","Pharma &amp; Healthcare","All",594,"http://www.reportbuyer.com/pharma_healthcare/production_manufacturing/world_market_plants_plants_parts_used_primarily_preparation_perfumes_pharmaceuticals_insecticides_fungicides.html","Published on 13-May-2010",195
"The World Market for Licorice Roots","ICON Group ","San Diego,, United States","Food & Drink","All",594,"http://www.reportbuyer.com/food_drink/flavours_ingredients/world_market_licorice_roots.html","Published on 13-May-2010",31
"The World Market for Ginseng Roots","ICON Group ","San Diego,, United States","Pharma &amp; Healthcare","All",594,"http://www.reportbuyer.com/pharma_healthcare/production_manufacturing/world_market_ginseng_roots.html","Published on 13-May-2010",47
"The World Market for Sugar Beet Seed","ICON Group ","San Diego,, United States","Industry & Manufacturing","All",594,"http://www.reportbuyer.com/industry_manufacturing/agriculture/crop/world_market_sugar_beet_seed.html","Published on 13-May-2010",56
"The World Market for Seed of Forage Plants Excluding Beet Seed","ICON Group ","San Diego,, United States","Industry & Manufacturing","All",594,"http://www.reportbuyer.com/industry_manufacturing/agriculture/crop/world_market_seed_forage_plants_excluding_beet_seed.html","Published on 13-May-2010",121
"The World Market for Seeds of Herbaceous Plant Cultivated Principally for Their Flowers","ICON Group ","San Diego,, United States","Industry & Manufacturing","All",594,"http://www.reportbuyer.com/industry_manufacturing/agriculture/crop/world_market_seeds_herbaceous_plant_cultivated_principally_flowers.html","Published on 13-May-2010",90
"The World Market for Plant Cuttings and Slips; Live Trees and Plants; and Bulbs, Tubers, and Rhizomes of Flowering or of Foliage Plants","ICON Group ","San Diego,, United States","Industry & Manufacturing","All",594,"http://www.reportbuyer.com/industry_manufacturing/agriculture/agricultural_products/world_market_plant_cuttings_slips_live_trees_plants_bulbs_tubers_rhizomes_flowering_foliage_plants.html","Published on 13-May-2010",198
"The World Market for Cut Flowers and Foliage","ICON Group ","San Diego,, United States","Industry & Manufacturing","All",594,"http://www.reportbuyer.com/industry_manufacturing/agriculture/agricultural_products/world_market_cut_flowers_foliage.html","Published on 13-May-2010",167
"The World Market for Prepared Cut Flowers and Flower Buds Suitable for Bouquets or Ornamental Use","ICON Group ","San Diego,, United States","Industry & Manufacturing","All",594,"http://www.reportbuyer.com/industry_manufacturing/agriculture/agricultural_products/world_market_prepared_cut_flowers_flower_buds_suitable_bouquets_ornamental_use.html","Published on 13-May-2010",145
"The World Market for Prepared Foliage, Grasses, Mosses, and Other Parts of Plants for Bouquets or Ornamental Use Excluding Flowers and Flower Buds","ICON Group ","San Diego,, United States","Industry & Manufacturing","All",594,"http://www.reportbuyer.com/industry_manufacturing/agriculture/agricultural_products/world_market_prepared_foliage_grasses_mosses_parts_plants_bouquets_ornamental_use_excluding_flowers_flower_buds.html","Published on 13-May-2010",139
"The World Market for Vegetable Materials Used Primarily for Stuffing or Padding Including Kapok, Vegetable Hair, and Eelgrass","ICON Group ","San Diego,, United States","Industry & Manufacturing","All",594,"http://www.reportbuyer.com/industry_manufacturing/materials/world_market_vegetable_materials_used_primarily_stuffing_padding_including_kapok_vegetable_hair_eelgrass.html","Published on 13-May-2010",28
"The World Market for Vegetable Materials Used Primarily in Brooms and Brushes Including Broomcorn, Piassava, Couch Grass, and Istle","ICON Group ","San Diego,, United States","Industry & Manufacturing","All",594,"http://www.reportbuyer.com/industry_manufacturing/materials/world_market_vegetable_materials_used_primarily_brooms_brushes_including_broomcorn_piassava_couch_grass_istle.html","Published on 13-May-2010",27
"The World Market for Vegetable Saps and Extracts","ICON Group ","San Diego,, United States","Chemicals","All",594,"http://www.reportbuyer.com/chemicals/substances/world_market_vegetable_saps_extracts.html","Published on 13-May-2010",148
"The World Market for Pectic Substances, Pectinates, and Pectates","ICON Group ","San Diego,, United States","Chemicals","All",594,"http://www.reportbuyer.com/chemicals/substances/world_market_pectic_substances_pectinates_pectates.html","Published on 13-May-2010",84
"The World Market for Mucilages and Thickeners Derived from Vegetable Products","ICON Group ","San Diego,, United States","Chemicals","All",594,"http://www.reportbuyer.com/chemicals/substances/world_market_mucilages_thickeners_derived_vegetable_products.html","Published on 13-May-2010",142
"The World Market for Seaweeds and Other Algae","ICON Group ","San Diego,, United States","Chemicals","All",594,"http://www.reportbuyer.com/chemicals/substances/world_market_seaweeds_algae.html","Published on 13-May-2010",93
"The World Market for Mineral Fuels, Lubricants, and Related Materials","ICON Group ","San Diego,, United States","Chemicals","All",594,"http://www.reportbuyer.com/chemicals/substances/world_market_mineral_fuels_lubricants_related_materials.html","Published on 13-May-2010",281
"The World Market for Unagglomerated Anthracite","ICON Group ","San Diego,, United States","Energy & Utilities","All",594,"http://www.reportbuyer.com/energy_utilities/coal/world_market_unagglomerated_anthracite.html","Published on 13-May-2010",85
"The World Market for Unagglomerated Coal Excluding Anthracite","ICON Group ","San Diego,, United States","Energy & Utilities","All",594,"http://www.reportbuyer.com/energy_utilities/coal/world_market_unagglomerated_coal_excluding_anthracite.html","Published on 13-May-2010",120
"The World Market for Unagglomerated Bituminous Coal","ICON Group ","San Diego,, United States","Energy & Utilities","All",594,"http://www.reportbuyer.com/energy_utilities/coal/world_market_unagglomerated_bituminous_coal.html","Published on 13-May-2010",85
"The World Market for Coal Briquettes, Ovoids, and Similar Solid Fuel Forms","ICON Group ","San Diego,, United States","Energy & Utilities","All",594,"http://www.reportbuyer.com/energy_utilities/coal/world_market_coal_briquettes_ovoids_similar_solid_fuel_forms.html","Published on 13-May-2010",54
"The World Market for Lignite Excluding Jet Fuel","ICON Group ","San Diego,, United States","Energy & Utilities","All",594,"http://www.reportbuyer.com/energy_utilities/coal/world_market_lignite_excluding_jet_fuel.html","Published on 13-May-2010",58
"The World Market for Unagglomerated Lignite Excluding Jet Fuel","ICON Group ","San Diego,, United States","Energy & Utilities","All",594,"http://www.reportbuyer.com/energy_utilities/coal/world_market_unagglomerated_lignite_excluding_jet_fuel.html","Published on 13-May-2010",50
"The World Market for Agglomerated Lignite Excluding Jet Fuel","ICON Group ","San Diego,, United States","Energy & Utilities","All",594,"http://www.reportbuyer.com/energy_utilities/coal/world_market_agglomerated_lignite_excluding_jet_fuel.html","Published on 13-May-2010",45
"The World Market for Peat and Peat Litter","ICON Group ","San Diego,, United States","Energy & Utilities","All",594,"http://www.reportbuyer.com/energy_utilities/biofuels/world_market_peat_peat_litter.html","Published on 13-May-2010",93
"The World Market for Retort Carbon and Coke or Semi-Coke of Coal, Lignite, and Peat","ICON Group ","San Diego,, United States","Energy & Utilities","All",594,"http://www.reportbuyer.com/energy_utilities/coal/world_market_retort_carbon_coke_semi_coke_coal_lignite_peat.html","Published on 13-May-2010",99
"The World Market for Crude Oils from Petroleum and Bituminous Minerals","ICON Group ","San Diego,, United States","Energy & Utilities","All",594,"http://www.reportbuyer.com/energy_utilities/oil_gas/crude_oil/world_market_crude_oils_petroleum_bituminous_minerals.html","Published on 13-May-2010",120
"The World Market for Gasoline and Other Light Oils","ICON Group ","San Diego,, United States","Energy & Utilities","All",594,"http://www.reportbuyer.com/energy_utilities/oil_gas/petrol_motor_fuel/world_market_gasoline_light_oils.html","Published on 13-May-2010",14
"The World Market for Gasoline and Aviation Fuel Excluding Jet Fuel","ICON Group ","San Diego,, United States","Energy & Utilities","All",594,"http://www.reportbuyer.com/energy_utilities/oil_gas/petrol_motor_fuel/world_market_gasoline_aviation_fuel_excluding_jet_fuel.html","Published on 13-May-2010",14
"The World Market for Kerosene and Other Medium Oils Excluding Gas Oils","ICON Group ","San Diego,, United States","Energy & Utilities","All",594,"http://www.reportbuyer.com/energy_utilities/oil_gas/petrol_motor_fuel/world_market_kerosene_medium_oils_excluding_gas_oils.html","Published on 13-May-2010",14
"The World Market for Kerosene and Kerosene-Type Jet Fuel","ICON Group ","San Diego,, United States","Energy & Utilities","All",594,"http://www.reportbuyer.com/energy_utilities/oil_gas/petrol_motor_fuel/world_market_kerosene_kerosene_type_jet_fuel.html","Published on 13-May-2010",14
"The World Market for Petroleum Jelly; Paraffin Wax, Microcrystalline Petroleum Wax, and Other Mineral Waxes Obtained by Synthesis or Other Process","ICON Group ","San Diego,, United States","Chemicals","All",594,"http://www.reportbuyer.com/chemicals/petrochemicals/world_market_petroleum_jelly_paraffin_wax_microcrystalline_petroleum_wax_mineral_waxes_obtained_synthesis_process.html","Published on 13-May-2010",179
"The World Market for Petroleum Jelly (Petrolatum)","ICON Group ","San Diego,, United States","Chemicals","All",594,"http://www.reportbuyer.com/chemicals/petrochemicals/world_market_petroleum_jelly_petrolatum.html","Published on 13-May-2010",90
"The World Market for Paraffin Wax, Microcrystalline Petroleum Wax, Slack Wax, Ozokerite, Lignite Wax, Peat Wax, and Similar Waxes","ICON Group ","San Diego,, United States","Chemicals","All",594,"http://www.reportbuyer.com/chemicals/petrochemicals/world_market_paraffin_wax_microcrystalline_petroleum_wax_slack_wax_ozokerite_lignite_wax_peat_wax_similar_waxes.html","Published on 13-May-2010",156
"The World Market for Mineral Tars and Their Distillation Products Including Similar Products Obtained by Processing Petroleum or by Any Other Process","ICON Group ","San Diego,, United States","Chemicals","All",594,"http://www.reportbuyer.com/chemicals/petrochemicals/world_market_mineral_tars_distillation_products_including_similar_products_obtained_processing_petroleum_process.html","Published on 13-May-2010",152
"The World Market for Tars Distilled from Coal, Lignite, Peat, or Other Mineral Tars Including Partially Distilled and Reconstituted Tars","ICON Group ","San Diego,, United States","Chemicals","All",594,"http://www.reportbuyer.com/chemicals/petrochemicals/world_market_tars_distilled_coal_lignite_peat_mineral_tars_including_partially_distilled_reconstituted_tars.html","Published on 13-May-2010",58
"The World Market for Benzene","ICON Group ","San Diego,, United States","Chemicals","All",594,"http://www.reportbuyer.com/chemicals/specialty_chemicals/world_market_benzene.html","Published on 13-May-2010",50
"The World Market for Toluene","ICON Group ","San Diego,, United States","Chemicals","All",594,"http://www.reportbuyer.com/chemicals/specialty_chemicals/world_market_toluene.html","Published on 13-May-2010",43
"The World Market for Xylene","ICON Group ","San Diego,, United States","Chemicals","All",594,"http://www.reportbuyer.com/chemicals/specialty_chemicals/world_market_xylene.html","Published on 13-May-2010",65
"The World Market for Pitch and Pitch Coke from Coal Tar or Other Mineral Tars","ICON Group ","San Diego,, United States","Chemicals","All",594,"http://www.reportbuyer.com/chemicals/petrochemicals/world_market_pitch_pitch_coke_coal_tar_mineral_tars.html","Published on 13-May-2010",82
"The World Market for Pitch from Coal Tar or Other Mineral Tars","ICON Group ","San Diego,, United States","Chemicals","All",594,"http://www.reportbuyer.com/chemicals/petrochemicals/world_market_pitch_coal_tar_mineral_tars.html","Published on 13-May-2010",62
"The World Market for Pitch Coke","ICON Group ","San Diego,, United States","Chemicals","All",594,"http://www.reportbuyer.com/chemicals/petrochemicals/world_market_pitch_coke.html","Published on 13-May-2010",44
"The World Market for Petroleum Bitumen, Residues of Petroleum or Bituminous Mineral Oils, and Bituminous Mixtures","ICON Group ","San Diego,, United States","Chemicals","All",594,"http://www.reportbuyer.com/chemicals/petrochemicals/world_market_petroleum_bitumen_residues_petroleum_bituminous_mineral_oils_bituminous_mixtures.html","Published on 13-May-2010",110
"The World Market for Petroleum Coke","ICON Group ","San Diego,, United States","Chemicals","All",594,"http://www.reportbuyer.com/chemicals/petrochemicals/world_market_petroleum_coke.html","Published on 13-May-2010",93
"The World Market for Liquefied Propane","ICON Group ","San Diego,, United States","Energy & Utilities","All",594,"http://www.reportbuyer.com/energy_utilities/oil_gas/liquid_petroleum_gas_lpg/world_market_liquefied_propane.html","Published on 13-May-2010",101
"The World Market for Liquefied Butane","ICON Group ","San Diego,, United States","Energy & Utilities","All",594,"http://www.reportbuyer.com/energy_utilities/oil_gas/liquid_petroleum_gas_lpg/world_market_liquefied_butane.html","Published on 13-May-2010",110
"The World Market for Liquefied Natural Gas","ICON Group ","San Diego,, United States","Energy & Utilities","All",594,"http://www.reportbuyer.com/energy_utilities/oil_gas/liquefied_natural_gas_lng/world_market_liquefied_natural_gas.html","Published on 13-May-2010",54
"The World Market for Natural Gas in the Gaseous State","ICON Group ","San Diego,, United States","Energy & Utilities","All",594,"http://www.reportbuyer.com/energy_utilities/oil_gas/natural_gas/world_market_natural_gas_gaseous_state.html","Published on 13-May-2010",58
"The World Market for Liquefied Ethylene, Propylene, Butylene, and Butadiene","ICON Group ","San Diego,, United States","Energy & Utilities","All",594,"http://www.reportbuyer.com/energy_utilities/oil_gas/liquid_petroleum_gas_lpg/world_market_liquefied_ethylene_propylene_butylene_butadiene.html","Published on 13-May-2010",52
"The World Market for Coal Gas, Water Gas, Producer Gas, and Similar Gases Excluding Petroleum Gases and Other Gaseous Hydrocarbons","ICON Group ","San Diego,, United States","Energy & Utilities","All",594,"http://www.reportbuyer.com/energy_utilities/oil_gas/world_market_coal_gas_water_gas_producer_gas_similar_gases_excluding_petroleum_gases_gaseous_hydrocarbons.html","Published on 13-May-2010",35
"The World Market for Electric Current","ICON Group ","San Diego,, United States","Energy & Utilities","All",594,"http://www.reportbuyer.com/energy_utilities/electricity/world_market_electric_current.html","Published on 13-May-2010",72
"The World Market for Animal and Vegetable Oils, Fats, and Waxes","ICON Group ","San Diego,, United States","Food & Drink","All",594,"http://www.reportbuyer.com/food_drink/edible_oils/world_market_animal_vegetable_oils_fats_waxes.html","Published on 13-May-2010",262
"The World Market for Fats and Oils from Fish and Marine Mammals and Their Fractions Excluding Chemically Modified Fractions","ICON Group ","San Diego,, United States","Food & Drink","All",594,"http://www.reportbuyer.com/food_drink/edible_oils/world_market_fats_oils_fish_marine_mammals_fractions_excluding_chemically_modified_fractions.html","Published on 13-May-2010",123
"The World Market for Fish Liver Oils and Their Fractions","ICON Group ","San Diego,, United States","Food & Drink","All",594,"http://www.reportbuyer.com/food_drink/edible_oils/world_market_fish_liver_oils_fractions.html","Published on 13-May-2010",76
"The World Market for Fish Fats and Oils and Their Fractions Excluding Fish Liver Oil","ICON Group ","San Diego,, United States","Food & Drink","All",594,"http://www.reportbuyer.com/food_drink/edible_oils/world_market_fish_fats_oils_fractions_excluding_fish_liver_oil.html","Published on 13-May-2010",111
"The World Market for Marine Mammal Fats, Oils, and Their Fractions","ICON Group ","San Diego,, United States","Food & Drink","All",594,"http://www.reportbuyer.com/food_drink/edible_oils/world_market_marine_mammal_fats_oils_fractions.html","Published on 13-May-2010",35
"The World Market for Pig Fat without Lean Meat and Unrendered Poultry Fat","ICON Group ","San Diego,, United States","Food & Drink","All",594,"http://www.reportbuyer.com/food_drink/edible_oils/world_market_pig_fat_without_lean_meat_unrendered_poultry_fat.html","Published on 13-May-2010",81
