"The World Market for Plates, Sheets, Strip, Rods, and Profile Shapes of Unhardened Vulcanized Noncellular Rubber","ICON Group ","San Diego,, United States","Industry & Manufacturing","All",594,"http://www.reportbuyer.com/industry_manufacturing/rubber/world_market_plates_sheets_strip_rods_profile_shapes_unhardened_vulcanized_noncellular_rubber.html","Published on 13-May-2010",172
"The World Market for Patent Leather, Patent Laminated Leather, and Metallic Leather","ICON Group ","San Diego,, United States","Industry & Manufacturing","All",594,"http://www.reportbuyer.com/industry_manufacturing/textiles/world_market_patent_leather_patent_laminated_leather_metallic_leather.html","Published on 13-May-2010",90
"The World Market for Reptile Leather","ICON Group ","San Diego,, United States","Industry & Manufacturing","All",594,"http://www.reportbuyer.com/industry_manufacturing/textiles/world_market_reptile_leather.html","Published on 13-May-2010",64
"The World Market for Parchment-Dressed or Prepared Goat or Kidskin Leather","ICON Group ","San Diego,, United States","Industry & Manufacturing","All",594,"http://www.reportbuyer.com/industry_manufacturing/textiles/world_market_parchment_dressed_prepared_goat_kidskin_leather.html","Published on 13-May-2010",99
"The World Market for Swine Leather","ICON Group ","San Diego,, United States","Industry & Manufacturing","All",594,"http://www.reportbuyer.com/industry_manufacturing/textiles/world_market_swine_leather.html","Published on 13-May-2010",83
"The World Market for Chamois Leather and Combination Chamois Leather","ICON Group ","San Diego,, United States","Industry & Manufacturing","All",594,"http://www.reportbuyer.com/industry_manufacturing/textiles/world_market_chamois_leather_combination_chamois_leather.html","Published on 13-May-2010",78
"The World Market for Tanned or Retanned Goat or Kidskin Leather","ICON Group ","San Diego,, United States","Industry & Manufacturing","All",594,"http://www.reportbuyer.com/industry_manufacturing/textiles/world_market_tanned_retanned_goat_kidskin_leather.html","Published on 13-May-2010",68
"The World Market for Goat or Kidskin Leather","ICON Group ","San Diego,, United States","Industry & Manufacturing","All",594,"http://www.reportbuyer.com/industry_manufacturing/textiles/world_market_goat_kidskin_leather.html","Published on 13-May-2010",116
"The World Market for Sheep or Lamb Skin Leather","ICON Group ","San Diego,, United States","Industry & Manufacturing","All",594,"http://www.reportbuyer.com/industry_manufacturing/textiles/world_market_sheep_lamb_skin_leather.html","Published on 13-May-2010",134
"The World Market for Tanned or Retanned Sheep or Lamb Skin Leather","ICON Group ","San Diego,, United States","Industry & Manufacturing","All",594,"http://www.reportbuyer.com/industry_manufacturing/textiles/world_market_tanned_retanned_sheep_lamb_skin_leather.html","Published on 13-May-2010",74
"The World Market for Parchment-Dressed or Prepared Sheep or Lamb Skin Leather","ICON Group ","San Diego,, United States","Industry & Manufacturing","All",594,"http://www.reportbuyer.com/industry_manufacturing/textiles/world_market_parchment_dressed_prepared_sheep_lamb_skin_leather.html","Published on 13-May-2010",111
"The World Market for Whole Bovine Skin Leather with a Surface Area Not Exceeding 28 Sq. Ft.","ICON Group ","San Diego,, United States","Industry & Manufacturing","All",594,"http://www.reportbuyer.com/industry_manufacturing/textiles/world_market_whole_bovine_skin_leather_surface_area_not_exceeding_28_sq_ft.html","Published on 13-May-2010",32
"The World Market for Composition Leather with a Leather or Leather Fiber Base in the Forms of Slabs, Sheets, or Strip","ICON Group ","San Diego,, United States","Industry & Manufacturing","All",594,"http://www.reportbuyer.com/industry_manufacturing/textiles/world_market_composition_leather_leather_leather_fiber_base_forms_slabs_sheets_strip.html","Published on 13-May-2010",100
"The World Market for Manufactured Goods","ICON Group ","San Diego,, United States","Industry & Manufacturing","All",594,"http://www.reportbuyer.com/industry_manufacturing/country_overviews_industry_manufacturing_/world_market_manufactured_goods.html","Published on 13-May-2010",372
"The World Market for Nonrefractory Mortars and Concretes","ICON Group ","San Diego,, United States","Industry & Manufacturing","All",594,"http://www.reportbuyer.com/industry_manufacturing/construction/construction_materials/world_market_nonrefractory_mortars_concretes.html","Published on 13-May-2010",110
"The World Market for Prepared Additives for Cements, Mortars, or Concretes","ICON Group ","San Diego,, United States","Industry & Manufacturing","All",594,"http://www.reportbuyer.com/industry_manufacturing/construction/construction_materials/world_market_prepared_additives_cements_mortars_concretes.html","Published on 13-May-2010",153
"The World Market for Supported Catalysts with Precious Metal or Precious Metal Compounds As Active Substances","ICON Group ","San Diego,, United States","Industry & Manufacturing","All",594,"http://www.reportbuyer.com/industry_manufacturing/metals/precious_metals/world_market_supported_catalysts_precious_metal_precious_metal_compounds_active_substances.html","Published on 13-May-2010",104
"The World Market for Pickling Preparations for Metal Surfaces, Fluxes and Other Products for Soldering, and Core or Coating Products for Welding Electrodes or Rods","ICON Group ","San Diego,, United States","Industry & Manufacturing","All",594,"http://www.reportbuyer.com/industry_manufacturing/metals/world_market_pickling_preparations_metal_surfaces_fluxes_products_soldering_core_coating_products_welding_electrodes_rods.html","Published on 13-May-2010",153
"The World Market for Supported Catalysts with Nickel or Nickel Compounds As Active Substances","ICON Group ","San Diego,, United States","Industry & Manufacturing","All",594,"http://www.reportbuyer.com/industry_manufacturing/metals/precious_metals/world_market_supported_catalysts_nickel_nickel_compounds_active_substances.html","Published on 13-May-2010",92
"The World Market for Prepared Culture Media for the Development of Micro-Organisms","ICON Group ","San Diego,, United States","Pharma &amp; Healthcare","All",594,"http://www.reportbuyer.com/pharma_healthcare/biotechnology/world_market_prepared_culture_media_development_micro_organisms.html","Published on 13-May-2010",116
"The World Market for Activated Natural Mineral Products, Animal Black, and Spent Animal Black","ICON Group ","San Diego,, United States","Chemicals","All",594,"http://www.reportbuyer.com/chemicals/specialty_chemicals/world_market_activated_natural_mineral_products_animal_black_spent_animal_black.html","Published on 13-May-2010",126
"The World Market for Activated Carbon","ICON Group ","San Diego,, United States","Chemicals","All",594,"http://www.reportbuyer.com/chemicals/specialty_chemicals/world_market_activated_carbon.html","Published on 13-May-2010",120
"The World Market for Prepared Rubber Accelerators","ICON Group ","San Diego,, United States","Chemicals","All",594,"http://www.reportbuyer.com/chemicals/specialty_chemicals/world_market_prepared_rubber_accelerators.html","Published on 13-May-2010",104
"The World Market for Semimanufactures of Artificial Graphite, Colloidal or Semi-Colloidal Graphite, and Graphite or Other Carbon Based Products","ICON Group ","San Diego,, United States","Chemicals","All",594,"http://www.reportbuyer.com/chemicals/substances/world_market_semimanufactures_artificial_graphite_colloidal_semi_colloidal_graphite_graphite_carbon_based_products.html","Published on 13-May-2010",143
"The World Market for Chemical Elements Doped for Use in Electronics, in Discs, Wafers, or Similar Forms and Chemical Compounds Doped for Use in Electronics","ICON Group ","San Diego,, United States","Chemicals","All",594,"http://www.reportbuyer.com/chemicals/specialty_chemicals/world_market_chemical_elements_doped_use_electronics_discs_wafers_similar_forms_chemical_compounds_doped_use_electronics.html","Published on 13-May-2010",124
"The World Market for Artificial Waxes and Prepared Waxes of Chemically Modified Lignite","ICON Group ","San Diego,, United States","Chemicals","All",594,"http://www.reportbuyer.com/chemicals/specialty_chemicals/world_market_artificial_waxes_prepared_waxes_chemically_modified_lignite.html","Published on 13-May-2010",40
"The World Market for Artificial Waxes and Prepared Waxes of Polyethylene Glycol","ICON Group ","San Diego,, United States","Chemicals","All",594,"http://www.reportbuyer.com/chemicals/specialty_chemicals/world_market_artificial_waxes_prepared_waxes_polyethylene_glycol.html","Published on 13-May-2010",82
"The World Market for Artificial Waxes and Prepared Waxes","ICON Group ","San Diego,, United States","Chemicals","All",594,"http://www.reportbuyer.com/chemicals/specialty_chemicals/world_market_artificial_waxes_prepared_waxes.html","Published on 13-May-2010",146
"The World Market for Gum, Wood or Sulfate Turpentine, Other Terpenic Oils, Crude Dipentene, Sulfite Turpentine, Other Crude Para-Cymene, and Pine Oil with Alpha-Terpinol","ICON Group ","San Diego,, United States","Chemicals","All",594,"http://www.reportbuyer.com/chemicals/substances/world_market_gum_wood_sulfate_turpentine_terpenic_oils_crude_dipentene_sulfite_turpentine_crude_para_cymene_pine_oil_alpha_terpinol.html","Published on 13-May-2010",101
"The World Market for Rosin, Rosin Acids and Their Derivatives, Rosin Spirit, and Rosin Oils","ICON Group ","San Diego,, United States","Chemicals","All",594,"http://www.reportbuyer.com/chemicals/substances/world_market_rosin_rosin_acids_derivatives_rosin_spirit_rosin_oils.html","Published on 13-May-2010",134
"The World Market for Wood Tar, Wood Tar Oils, Wood Creosote, Wood Naphtha, Vegetable Pitch, Brewers Pitch, and Like Products Based on Rosin, Resin Acids, or Vegetable Pitch","ICON Group ","San Diego,, United States","Chemicals","All",594,"http://www.reportbuyer.com/chemicals/substances/world_market_wood_tar_wood_tar_oils_wood_creosote_wood_naphtha_vegetable_pitch_brewers_pitch_products_based_rosin_resin_acids_vegetable_pitch.html","Published on 13-May-2010",79
"The World Market for Residual Lyes from the Manufacture of Wood Pulp and Lignin Sulfonates Excluding Tall Oil","ICON Group ","San Diego,, United States","Chemicals","All",594,"http://www.reportbuyer.com/chemicals/substances/world_market_residual_lyes_manufacture_wood_pulp_lignin_sulfonates_excluding_tall_oil.html","Published on 13-May-2010",107
"The World Market for Tall Oil","ICON Group ","San Diego,, United States","Chemicals","All",594,"http://www.reportbuyer.com/chemicals/substances/world_market_tall_oil.html","Published on 13-May-2010",65
"The World Market for Wood-Based and Resin-Based Chemical Products","ICON Group ","San Diego,, United States","Chemicals","All",594,"http://www.reportbuyer.com/chemicals/substances/world_market_wood_based_resin_based_chemical_products.html","Published on 13-May-2010",157
"The World Market for Lubricating Preparations Containing Oils or Greases from Sources Other Than Petroleum or Bituminous Minerals","ICON Group ","San Diego,, United States","Chemicals","All",594,"http://www.reportbuyer.com/chemicals/substances/world_market_lubricating_preparations_containing_oils_greases_sources_petroleum_bituminous_minerals.html","Published on 13-May-2010",173
"The World Market for Preparations Containing Oil or Grease for the Treatment of Textiles, Leather, Furskins, or Other Materials Excluding Oils or Greases of Petroleum or Bituminous Minerals","ICON Group ","San Diego,, United States","Chemicals","All",594,"http://www.reportbuyer.com/chemicals/specialty_chemicals/world_market_preparations_containing_oil_grease_treatment_textiles_leather_furskins_materials_excluding_oils_greases_petroleum_bituminous_minerals.html","Published on 13-May-2010",128
"The World Market for Preparations for Treating Textiles, Leather, Furskins, or Other Materials Containing Less Than 70% by Weight of Petroleum or Bituminous Mineral Oils","ICON Group ","San Diego,, United States","Chemicals","All",594,"http://www.reportbuyer.com/chemicals/specialty_chemicals/world_market_preparations_treating_textiles_leather_furskins_materials_containing_less_70_weight_petroleum_bituminous_mineral_oils.html","Published on 13-May-2010",112
"The World Market for Lubricating Preparations Containing Less Than 70% by Weight of Petroleum or Bituminous Mineral Oils","ICON Group ","San Diego,, United States","Chemicals","All",594,"http://www.reportbuyer.com/chemicals/specialty_chemicals/world_market_lubricating_preparations_containing_less_70_weight_petroleum_bituminous_mineral_oils.html","Published on 13-May-2010",194
"The World Market for Antifreezing Preparations and Deicing Fluids","ICON Group ","San Diego,, United States","Chemicals","All",594,"http://www.reportbuyer.com/chemicals/specialty_chemicals/world_market_antifreezing_preparations_deicing_fluids.html","Published on 13-May-2010",120
"The World Market for Hydraulic Brake Fluids and Prepared Liquids for Hydraulic Transmissions Containing Less Than 70% by Weight of Petroleum or Bituminous Mineral Oils","ICON Group ","San Diego,, United States","Chemicals","All",594,"http://www.reportbuyer.com/chemicals/specialty_chemicals/world_market_hydraulic_brake_fluids_prepared_liquids_hydraulic_transmissions_containing_less_70_weight_petroleum_bituminous_mineral_oils.html","Published on 13-May-2010",142
"The World Market for Additives for Lubricating Oils","ICON Group ","San Diego,, United States","Chemicals","All",594,"http://www.reportbuyer.com/chemicals/specialty_chemicals/world_market_additives_lubricating_oils.html","Published on 13-May-2010",141
"The World Market for Prepared Liquids for Hydraulic Transmissions and Antifreezing Preparations","ICON Group ","San Diego,, United States","Chemicals","All",594,"http://www.reportbuyer.com/chemicals/specialty_chemicals/world_market_prepared_liquids_hydraulic_transmissions_antifreezing_preparations.html","Published on 13-May-2010",151
"The World Market for Antiknock Preparations","ICON Group ","San Diego,, United States","Chemicals","All",594,"http://www.reportbuyer.com/chemicals/specialty_chemicals/world_market_antiknock_preparations.html","Published on 13-May-2010",97
"The World Market for Fireworks","ICON Group ","San Diego,, United States","Chemicals","All",594,"http://www.reportbuyer.com/chemicals/specialty_chemicals/world_market_fireworks.html","Published on 13-May-2010",78
"The World Market for Antiknock Preparations, Oxidation Inhibitors, Anticorrosive Preparations, and Other Prepared Additives for Mineral Oils Including Gasoline","ICON Group ","San Diego,, United States","Chemicals","All",594,"http://www.reportbuyer.com/chemicals/specialty_chemicals/world_market_antiknock_preparations_oxidation_inhibitors_anticorrosive_preparations_prepared_additives_mineral_oils_including_gasoline.html","Published on 13-May-2010",191
"The World Market for Fireworks, Signaling Flares, Rain Rockets, Fog Signals and Other Pyrotechnic Articles","ICON Group ","San Diego,, United States","Chemicals","All",594,"http://www.reportbuyer.com/chemicals/specialty_chemicals/world_market_fireworks_signaling_flares_rain_rockets_fog_signals_pyrotechnic_articles.html","Published on 13-May-2010",109
"The World Market for Safety Fuses, Detonating Fuses, Percussion or Detonating Caps, Igniters, and Electric Detonators","ICON Group ","San Diego,, United States","Chemicals","All",594,"http://www.reportbuyer.com/chemicals/specialty_chemicals/world_market_safety_fuses_detonating_fuses_percussion_detonating_caps_igniters_electric_detonators.html","Published on 13-May-2010",124
"The World Market for Prepared Explosives Excluding Propellant Powders","ICON Group ","San Diego,, United States","Chemicals","All",594,"http://www.reportbuyer.com/chemicals/specialty_chemicals/world_market_prepared_explosives_excluding_propellant_powders.html","Published on 13-May-2010",109
"The World Market for Propellant Powders","ICON Group ","San Diego,, United States","Chemicals","All",594,"http://www.reportbuyer.com/chemicals/specialty_chemicals/world_market_propellant_powders.html","Published on 13-May-2010",73
"The World Market for Propellent Powders and Other Prepared Explosives","ICON Group ","San Diego,, United States","Chemicals","All",594,"http://www.reportbuyer.com/chemicals/specialty_chemicals/world_market_propellent_powders_prepared_explosives.html","Published on 13-May-2010",120
"The World Market for Glues Based on Starches, Dextrins, or Other Modified Starches","ICON Group ","San Diego,, United States","Chemicals","All",594,"http://www.reportbuyer.com/chemicals/adhesives_sealants/world_market_glues_based_starches_dextrins_modified_starches.html","Published on 13-May-2010",111
"The World Market for Dextrins and Other Modified Starches","ICON Group ","San Diego,, United States","Chemicals","All",594,"http://www.reportbuyer.com/chemicals/adhesives_sealants/world_market_dextrins_modified_starches.html","Published on 13-May-2010",141
"The World Market for Caseinates, Casein Derivatives, and Casein Glues","ICON Group ","San Diego,, United States","Chemicals","All",594,"http://www.reportbuyer.com/chemicals/adhesives_sealants/world_market_caseinates_casein_derivatives_casein_glues.html","Published on 13-May-2010",106
"The World Market for Albumins and Albumin Derivitives Excluding Egg Albumins","ICON Group ","San Diego,, United States","Chemicals","All",594,"http://www.reportbuyer.com/chemicals/adhesives_sealants/world_market_albumins_albumin_derivitives_excluding_egg_albumins.html","Published on 13-May-2010",83
"The World Market for Casein","ICON Group ","San Diego,, United States","Chemicals","All",594,"http://www.reportbuyer.com/chemicals/adhesives_sealants/world_market_casein.html","Published on 13-May-2010",101
"The World Market for Albuminoidal Substances, Modified Starches,  and Glues","ICON Group ","San Diego,, United States","Chemicals","All",594,"http://www.reportbuyer.com/chemicals/adhesives_sealants/world_market_albuminoidal_substances_modified_starches_glues.html","Published on 13-May-2010",227
"The World Market for Wheat Gluten","ICON Group ","San Diego,, United States","Food & Drink","All",594,"http://www.reportbuyer.com/food_drink/flavours_ingredients/world_market_wheat_gluten.html","Published on 13-May-2010",82
"The World Market for Inulin","ICON Group ","San Diego,, United States","Food & Drink","All",594,"http://www.reportbuyer.com/food_drink/flavours_ingredients/world_market_inulin.html","Published on 13-May-2010",55
"The World Market for Cassava (Manioc) Starch","ICON Group ","San Diego,, United States","Food & Drink","All",594,"http://www.reportbuyer.com/food_drink/flavours_ingredients/world_market_cassava_manioc_starch.html","Published on 13-May-2010",67
"The World Market for Potato Starch","ICON Group ","San Diego,, United States","Food & Drink","All",594,"http://www.reportbuyer.com/food_drink/flavours_ingredients/world_market_potato_starch.html","Published on 13-May-2010",85
"The World Market for Wheat Starch","ICON Group ","San Diego,, United States","Food & Drink","All",594,"http://www.reportbuyer.com/food_drink/flavours_ingredients/world_market_wheat_starch.html","Published on 13-May-2010",70
"The World Market for Corn Starch","ICON Group ","San Diego,, United States","Food & Drink","All",594,"http://www.reportbuyer.com/food_drink/flavours_ingredients/world_market_corn_starch.html","Published on 13-May-2010",107
"The World Market for Starches, Inulin, and Wheat Gluten","ICON Group ","San Diego,, United States","Food & Drink","All",594,"http://www.reportbuyer.com/food_drink/flavours_ingredients/world_market_starches_inulin_wheat_gluten.html","Published on 13-May-2010",148
"The World Market for Rodenticides for Retail Sale","ICON Group ","San Diego,, United States","Chemicals","All",594,"http://www.reportbuyer.com/chemicals/agricultural_chemicals/world_market_rodenticides_retail_sale.html","Published on 13-May-2010",137
"The World Market for Disinfectants for Retail Sale","ICON Group ","San Diego,, United States","Chemicals","All",594,"http://www.reportbuyer.com/chemicals/agricultural_chemicals/world_market_disinfectants_retail_sale.html","Published on 13-May-2010",133
"The World Market for Disinfectants and Rodenticides for Retail Sale","ICON Group ","San Diego,, United States","Chemicals","All",594,"http://www.reportbuyer.com/chemicals/agricultural_chemicals/world_market_disinfectants_rodenticides_retail_sale.html","Published on 13-May-2010",182
"The World Market for Herbicides, Weed Killers, Antisprouting Products, and Plant-Growth Regulators for Retail Sale","ICON Group ","San Diego,, United States","Chemicals","All",594,"http://www.reportbuyer.com/chemicals/agricultural_chemicals/world_market_herbicides_weed_killers_antisprouting_products_plant_growth_regulators_retail_sale.html","Published on 13-May-2010",172
"The World Market for Insecticides for Retail Sale","ICON Group ","San Diego,, United States","Chemicals","All",594,"http://www.reportbuyer.com/chemicals/agricultural_chemicals/world_market_insecticides_retail_sale.html","Published on 13-May-2010",185
"The World Market for Rods, Sticks and Profile Shapes Made of Ethylene Polymers of Surface-Worked Monofilament with a Cross-Sectional Dimension Exceeding 1 mm","ICON Group ","San Diego,, United States","Chemicals","All",594,"http://www.reportbuyer.com/chemicals/plastics/polymers/world_market_rods_sticks_profile_shapes_made_ethylene_polymers_surface_worked_monofilament_cross_sectional_dimension_exceeding_mm.html","Published on 13-May-2010",109
"The World Market for Fungicides for Retail Sale","ICON Group ","San Diego,, United States","Chemicals","All",594,"http://www.reportbuyer.com/chemicals/agricultural_chemicals/world_market_fungicides_retail_sale.html","Published on 13-May-2010",168
"The World Market for Rods, Sticks and Profile Shapes Made of Vinyl Chloride Polymers of Surface-Worked Monofilament with a Cross-Sectional Dimension Exceeding 1 mm","ICON Group ","San Diego,, United States","Chemicals","All",594,"http://www.reportbuyer.com/chemicals/plastics/polymers/world_market_rods_sticks_profile_shapes_made_vinyl_chloride_polymers_surface_worked_monofilament_cross_sectional_dimension_exceeding_mm.html","Published on 13-May-2010",157
"The World Market for Plates, Sheets, Film, Foil, and Strip Made from Vulcanized Fibers","ICON Group ","San Diego,, United States","Chemicals","All",594,"http://www.reportbuyer.com/chemicals/plastics/polymers/world_market_plates_sheets_film_foil_strip_made_vulcanized_fibers.html","Published on 13-May-2010",60
"The World Market for Plates, Sheets, Film, Foil, and Strip Made from Polycarbonates, Alkyd Resins, or Other Polyesters","ICON Group ","San Diego,, United States","Chemicals","All",594,"http://www.reportbuyer.com/chemicals/plastics/polymers/world_market_plates_sheets_film_foil_strip_made_polycarbonates_alkyd_resins_polyesters.html","Published on 13-May-2010",191
"The World Market for Plates, Sheets, Film, Foil, and Strip Made from Acrylic Polymers","ICON Group ","San Diego,, United States","Chemicals","All",594,"http://www.reportbuyer.com/chemicals/plastics/polymers/world_market_plates_sheets_film_foil_strip_made_acrylic_polymers.html","Published on 13-May-2010",157
"The World Market for Plates, Sheets, Film, Foil, and Strip Made from Vinyl Chloride Polymers","ICON Group ","San Diego,, United States","Chemicals","All",594,"http://www.reportbuyer.com/chemicals/plastics/polymers/world_market_plates_sheets_film_foil_strip_made_vinyl_chloride_polymers.html","Published on 13-May-2010",189
"The World Market for Plates, Sheets, Film, Foil, and Strip Made from Styrene Polymers","ICON Group ","San Diego,, United States","Chemicals","All",594,"http://www.reportbuyer.com/chemicals/plastics/polymers/world_market_plates_sheets_film_foil_strip_made_styrene_polymers.html","Published on 13-May-2010",144
"The World Market for Plates, Sheets, Film, Foil, and Strip Made from Propylene Polymers","ICON Group ","San Diego,, United States","Chemicals","All",594,"http://www.reportbuyer.com/chemicals/plastics/polymers/world_market_plates_sheets_film_foil_strip_made_propylene_polymers.html","Published on 13-May-2010",207
"The World Market for Plates, Sheets, Film, Foil, and Strip Made of Ethylene Polymers","ICON Group ","San Diego,, United States","Chemicals","All",594,"http://www.reportbuyer.com/chemicals/plastics/polymers/world_market_plates_sheets_film_foil_strip_made_ethylene_polymers.html","Published on 13-May-2010",209
"The World Market for Self-Adhesive Plastic Plates, Sheets, Film, Foil, Tape, and Other Flat Shapes in Rolls Up to 20 Centimeters Wide","ICON Group ","San Diego,, United States","Chemicals","All",594,"http://www.reportbuyer.com/chemicals/plastics/world_market_self_adhesive_plastic_plates_sheets_film_foil_tape_flat_shapes_rolls_20_centimeters_wide.html","Published on 13-May-2010",201
"The World Market for Self-Adhesive Plastic Plates, Sheets, Film, Foil, Tape, and Other Flat Shapes Excluding Articles Designed as Floor, Wall, or Ceiling Coverings","ICON Group ","San Diego,, United States","Chemicals","All",594,"http://www.reportbuyer.com/chemicals/plastics/world_market_self_adhesive_plastic_plates_sheets_film_foil_tape_flat_shapes_excluding_articles_designed_floor_wall_ceiling_coverings.html","Published on 13-May-2010",226
"The World Market for Plastic Fittings for Tubes, Pipes, and Hoses Including Joints, Elbows, and Flanges","ICON Group ","San Diego,, United States","Chemicals","All",594,"http://www.reportbuyer.com/chemicals/plastics/world_market_plastic_fittings_tubes_pipes_hoses_including_joints_elbows_flanges.html","Published on 13-May-2010",194
