"Janitorial Services in the US","IBISWorld","Jersey City, United States","Business &amp; Government","United States",821,"http://www.reportbuyer.com/business_government/facilities_management/commercial_cleaning/janitorial_services_us.html","Published on 09-Sep-2011",31
"Business Service Centers in the US","IBISWorld","Jersey City, United States","Business &amp; Government","United States",751,"http://www.reportbuyer.com/business_government/facilities_management/business_service_centers_us.html","Published on 08-Aug-2010",31
"Construction &amp; Civil Engineering Equipment Leasing in the UK","IBISWorld","Jersey City, United States","Industry & Manufacturing","United Kingdom",798,"http://www.reportbuyer.com/industry_manufacturing/plant_heavy_equipment/construction_civil_engineering_equipment_leasing_uk.html","Published on 06-Jun-2011",29
"Collection Agencies in the US","IBISWorld","Jersey City, United States","Banking & Finance","United States",751,"http://www.reportbuyer.com/banking_finance/transaction_credit_collections/collection_agencies_us.html","Published on 15-Jan-2008",36
"Credit Bureaus in the US","IBISWorld","Jersey City, United States","Banking & Finance","United States",751,"http://www.reportbuyer.com/banking_finance/transaction_credit_collections/credit_bureaus_us.html","Published on 03-Mar-2009",38
"Other Business Support Services in the US","IBISWorld","Jersey City, United States","Business &amp; Government","United States",751,"http://www.reportbuyer.com/business_government/country_overview_business_services/business_support_services_us.html","Published on 20-Jul-2006",26
"Tour Operators in the US","IBISWorld","Jersey City, United States","Leisure & Media","United States",821,"http://www.reportbuyer.com/leisure_media/tourism_travel/tour_operators_us.html","Published on 11-Nov-2010",34
"Security Systems Services in the US","IBISWorld","Jersey City, United States","Business &amp; Government","United States",751,"http://www.reportbuyer.com/business_government/security/security_services/security_systems_services_us.html","Published on 27-Nov-2007",40
"Pest Control in the US","IBISWorld","Jersey City, United States","Business &amp; Government","United States",821,"http://www.reportbuyer.com/business_government/misc_business_services/pest_control_us.html","Published on 09-Sep-2011",41
"Duck Production in the US","IBISWorld","Jersey City, United States","Food & Drink","United States",751,"http://www.reportbuyer.com/food_drink/meat_poultry/duck_production_us.html","Published on 07-Jul-2009",35
"Carpet and Upholstery Cleaning Services in the US","IBISWorld","Jersey City, United States","Business &amp; Government","United States",751,"http://www.reportbuyer.com/business_government/facilities_management/commercial_cleaning/carpet_upholstery_cleaning_services_us.html","Published on 20-Sep-2007",31
"Other Services to Buildings and Dwellings in the US","IBISWorld","Jersey City, United States","Business &amp; Government","United States",751,"http://www.reportbuyer.com/business_government/misc_business_services/services_buildings_dwellings_us.html","Published on 09-Jan-2007",24
"Marine Services in China","IBISWorld","Jersey City, United States","Food & Drink","China",821,"http://www.reportbuyer.com/food_drink/fish_seafood/marine_services_china.html","Published on 05-May-2011",32
"Waste Collection in the US","IBISWorld","Jersey City, United States","Industry & Manufacturing","United States",751,"http://www.reportbuyer.com/industry_manufacturing/environmental_services/waste_management/waste_collection_us.html","Published on 26-Nov-2007",45
"Materials Recovery Facilities in the US","IBISWorld","Jersey City, United States","Industry & Manufacturing","United States",751,"http://www.reportbuyer.com/industry_manufacturing/environmental_services/waste_management/materials_recovery_facilities_us.html","Published on 03-Aug-2007",42
"All Other Waste Management Services in the US","IBISWorld","Jersey City, United States","Industry & Manufacturing","United States",751,"http://www.reportbuyer.com/industry_manufacturing/environmental_services/waste_management/waste_management_services_us.html","Published on 10-Jan-2008",38
"Public Elementary and Secondary Schools in the US","IBISWorld","Jersey City, United States","Business &amp; Government","United States",751,"http://www.reportbuyer.com/business_government/education/public_elementary_secondary_schools_us.html","Published on 08-Aug-2007",34
"Private Elementary and Secondary Schools in the US","IBISWorld","Jersey City, United States","Business &amp; Government","United States",751,"http://www.reportbuyer.com/business_government/education/private_elementary_secondary_schools_us.html","Published on 05-Sep-2007",37
"Colleges, Universities and Professional Schools in the US","IBISWorld","Jersey City, United States","Business &amp; Government","United States",751,"http://www.reportbuyer.com/business_government/education/university/colleges_universities_professional_schools_us.html","Published on 01-Feb-2008",47
"Business and Secretarial Schools in the US","IBISWorld","Jersey City, United States","Business &amp; Government","United States",751,"http://www.reportbuyer.com/business_government/education/business_secretarial_schools_us.html","Published on 05-Nov-2007",33
"Computer Training in the US","IBISWorld","Jersey City, United States","Business &amp; Government","United States",751,"http://www.reportbuyer.com/business_government/education/computer_training_us.html","Published on 30-Aug-2007",35
"Professional and Management Development Training in the US","IBISWorld","Jersey City, United States","Business &amp; Government","United States",751,"http://www.reportbuyer.com/business_government/education/professional_management_development_training_us.html","Published on 07-Sep-2007",35
"Technical and Trade Schools in the US","IBISWorld","Jersey City, United States","Business &amp; Government","United States",751,"http://www.reportbuyer.com/business_government/education/technical_trade_schools_us.html","Published on 11-Sep-2007",39
"Fine Arts Schools in the US","IBISWorld","Jersey City, United States","Business &amp; Government","United States",821,"http://www.reportbuyer.com/business_government/education/fine_arts_schools_us.html","Published on 07-Jul-2011",33
"Nursing Care Facilities in the US","IBISWorld","Jersey City, United States","Pharma &amp; Healthcare","United States",821,"http://www.reportbuyer.com/pharma_healthcare/healthcare/hospital/nursing_care_facilities_us.html","Published on 07-Jul-2011",39
"Pet Grooming &amp; Boarding in the US","IBISWorld","Jersey City, United States","Consumer Goods & Retail","United States",821,"http://www.reportbuyer.com/consumer_goods_retail/pet_products/pet_grooming_boarding_us_1.html","Published on 07-Jul-2011",30
"Power Tools &amp; Other General Purpose Machinery Manufacturing in the US","IBISWorld","Jersey City, United States","Industry & Manufacturing","United States",821,"http://www.reportbuyer.com/industry_manufacturing/machinery/industrial_machinery/power_tools_general_purpose_machinery_manufacturing_us.html","Published on 07-Jul-2011",35
"Sports and Recreation Instruction in the US","IBISWorld","Jersey City, United States","Business &amp; Government","United States",751,"http://www.reportbuyer.com/business_government/education/sports_recreation_instruction_us.html","Published on 05-Dec-2006",30
"Language Schools in the US","IBISWorld","Jersey City, United States","Business &amp; Government","United States",751,"http://www.reportbuyer.com/business_government/education/language_schools_us.html","Published on 15-Jun-2007",33
"All Other Schools and Instruction in the US","IBISWorld","Jersey City, United States","Business &amp; Government","United States",751,"http://www.reportbuyer.com/business_government/education/schools_instruction_us.html","Published on 05-Sep-2007",37
"Educational Support Services in the US","IBISWorld","Jersey City, United States","Business &amp; Government","United States",751,"http://www.reportbuyer.com/business_government/education/educational_support_services_us.html","Published on 15-Jun-2007",34
"Offices of General and Family Practice Physicians in the US","IBISWorld","Jersey City, United States","Pharma &amp; Healthcare","United States",751,"http://www.reportbuyer.com/pharma_healthcare/healthcare/offices_general_family_practice_physicians_us.html","Published on 01-Feb-2008",38
"Offices of Specialist Physicians in the US","IBISWorld","Jersey City, United States","Pharma &amp; Healthcare","United States",751,"http://www.reportbuyer.com/pharma_healthcare/healthcare/offices_specialist_physicians_us.html","Published on 17-Jan-2008",37
"Offices of Dentists in the US","IBISWorld","Jersey City, United States","Pharma &amp; Healthcare","United States",751,"http://www.reportbuyer.com/pharma_healthcare/dental/offices_dentists_us.html","Published on 19-Nov-2007",33
"Offices of Chiropractors in the US","IBISWorld","Jersey City, United States","Pharma &amp; Healthcare","United States",751,"http://www.reportbuyer.com/pharma_healthcare/general_industry/offices_chiropractors_us.html","Published on 30-Jul-2007",29
"Offices of Optometrists in the US","IBISWorld","Jersey City, United States","Pharma &amp; Healthcare","United States",751,"http://www.reportbuyer.com/pharma_healthcare/healthcare/offices_optometrists_us.html","Published on 01-Feb-2008",32
"Offices of Mental Health Practitioners (except Physicians) in the US","IBISWorld","Jersey City, United States","Pharma &amp; Healthcare","United States",751,"http://www.reportbuyer.com/pharma_healthcare/healthcare/offices_mental_health_practitioners_except_physicians_us.html","Published on 21-Apr-2006",21
"Offices of Physical, Occupational and Speech Therapists and Audiologists in the US","IBISWorld","Jersey City, United States","Pharma &amp; Healthcare","United States",751,"http://www.reportbuyer.com/pharma_healthcare/general_industry/offices_physical_occupational_speech_therapists_audiologists_us.html","Published on 31-Aug-2007",39
"Offices of All Other Health Practitioners in the US","IBISWorld","Jersey City, United States","Pharma &amp; Healthcare","United States",751,"http://www.reportbuyer.com/pharma_healthcare/healthcare/offices_health_practitioners_us.html","Published on 05-Feb-2008",30
"Family Planning Centers in the US","IBISWorld","Jersey City, United States","Pharma &amp; Healthcare","United States",751,"http://www.reportbuyer.com/pharma_healthcare/generic_drugs/generic_drug_patents/family_planning_centers_us.html","Published on 18-Apr-2007",28
"Mental Health &amp; Substance Abuse Clinics in the US","IBISWorld","Jersey City, United States","Pharma &amp; Healthcare","United States",821,"http://www.reportbuyer.com/pharma_healthcare/healthcare/mental_health_substance_abuse_centers_us.html","Published on 08-Aug-2011",34
"Other Outpatient Care Centers in the US","IBISWorld","Jersey City, United States","Pharma &amp; Healthcare","United States",751,"http://www.reportbuyer.com/pharma_healthcare/healthcare/outpatient_care_centers_us.html","Published on 01-Feb-2008",48
"Measuring, Testing &amp; Navigational Instrument Manufacturing in the US","IBISWorld","Jersey City, United States","Computing & Electronics","United States",751,"http://www.reportbuyer.com/computing_electronics/scientific_technical_instruments/measuring_testing_navigational_instrument_manufacturing_us.html","Published on 09-Sep-2009",45
"Home Health Care Services in the US","IBISWorld","Jersey City, United States","Pharma &amp; Healthcare","United States",751,"http://www.reportbuyer.com/pharma_healthcare/healthcare/home_health_care_services_us.html","Published on 01-Feb-2008",44
"All Other Ambulatory Health Care Services in the US","IBISWorld","Jersey City, United States","Pharma &amp; Healthcare","United States",751,"http://www.reportbuyer.com/pharma_healthcare/healthcare/ambulatory_health_care_services_us.html","Published on 01-Feb-2008",39
"General Hospitals in Australia","IBISWorld","Jersey City, United States","Pharma &amp; Healthcare","Australia",876,"http://www.reportbuyer.com/pharma_healthcare/healthcare/hospital/general_hospitals_australia.html","Published on 07-Jul-2011",39
"Psychiatric and Substance Abuse Hospitals in the US","IBISWorld","Jersey City, United States","Pharma &amp; Healthcare","United States",751,"http://www.reportbuyer.com/pharma_healthcare/healthcare/hospital/psychiatric_substance_abuse_hospitals_us.html","Published on 27-Sep-2007",39
"Specialty (except Psychiatric and Substance Abuse) Hospitals in the US","IBISWorld","Jersey City, United States","Pharma &amp; Healthcare","United States",751,"http://www.reportbuyer.com/pharma_healthcare/healthcare/hospital/specialty_except_psychiatric_substance_abuse_hospitals_us.html","Published on 19-Nov-2007",42
"Residential Mental Retardation Facilities in the US","IBISWorld","Jersey City, United States","Pharma &amp; Healthcare","United States",751,"http://www.reportbuyer.com/pharma_healthcare/healthcare/hospital/residential_mental_retardation_facilities_us.html","Published on 17-Jan-2006",25
"Residential Mental Health and Substance Abuse Facilities in the US","IBISWorld","Jersey City, United States","Pharma &amp; Healthcare","United States",751,"http://www.reportbuyer.com/pharma_healthcare/healthcare/hospital/residential_mental_health_substance_abuse_facilities_us.html","Published on 17-Oct-2007",37
"Community Care Facilities for the Elderly in the US","IBISWorld","Jersey City, United States","Pharma &amp; Healthcare","United States",751,"http://www.reportbuyer.com/pharma_healthcare/healthcare/community_care_facilities_elderly_us.html","Published on 01-Feb-2008",41
"Other Residential Care Facilities in the US","IBISWorld","Jersey City, United States","Pharma &amp; Healthcare","United States",751,"http://www.reportbuyer.com/pharma_healthcare/healthcare/residential_care_facilities_us.html","Published on 05-Nov-2007",42
"Adoption &amp; Child Welfare Services in the US","IBISWorld","Jersey City, United States","Business &amp; Government","United States",751,"http://www.reportbuyer.com/business_government/government/adoption_child_welfare_services_us.html","Published on 12-Dec-2009",30
"Services for the Elderly and Persons with Disabilities in the US","IBISWorld","Jersey City, United States","Business &amp; Government","United States",751,"http://www.reportbuyer.com/business_government/care_social_services/services_elderly_persons_disabilities_us.html","Published on 05-Nov-2007",47
"Other Individual and Family Services in the US","IBISWorld","Jersey City, United States","Business &amp; Government","United States",751,"http://www.reportbuyer.com/business_government/care_social_services/individual_family_services_us.html","Published on 23-Apr-2007",41
"Community Food Services in the US","IBISWorld","Jersey City, United States","Business &amp; Government","United States",821,"http://www.reportbuyer.com/business_government/care_social_services/community_food_services_us.html","Published on 02-Feb-2011",38
"Community Housing Services in the US","IBISWorld","Jersey City, United States","Business &amp; Government","United States",821,"http://www.reportbuyer.com/business_government/care_social_services/community_housing_services_us.html","Published on 02-Feb-2011",32
"Emergency and Other Relief Services in the US","IBISWorld","Jersey City, United States","Business &amp; Government","United States",751,"http://www.reportbuyer.com/business_government/care_social_services/emergency_relief_services_us.html","Published on 02-Apr-2007",41
"Vocational Rehabilitation Services in the US","IBISWorld","Jersey City, United States","Business &amp; Government","United States",751,"http://www.reportbuyer.com/business_government/government/vocational_rehabilitation_services_us.html","Published on 02-Feb-2010",31
"Blood, Organ &amp; Ambulatory Health Services in the US","IBISWorld","Jersey City, United States","Pharma &amp; Healthcare","United States",821,"http://www.reportbuyer.com/pharma_healthcare/healthcare/blood_organ_ambulatory_health_services_us.html","Published on 04-Apr-2011",39
"Child Day Care Services in the US","IBISWorld","Jersey City, United States","Business &amp; Government","United States",821,"http://www.reportbuyer.com/business_government/care_social_services/child_day_care_services_us.html","Published on 01-Jan-2011",29
"Youth Programs &amp; Miscellaneous Care Facilities in the US","IBISWorld","Jersey City, United States","Pharma &amp; Healthcare","United States",751,"http://www.reportbuyer.com/pharma_healthcare/healthcare/hospital/youth_programs_miscellaneous_care_facilities_us_1.html","Published on 08-Aug-2010",35
"Butter &amp; Cheese Production in the UK","IBISWorld","Jersey City, United States","Food & Drink","United Kingdom",806,"http://www.reportbuyer.com/food_drink/dairy/cheese/butter_cheese_production_uk.html","Published on 07-Jul-2011",30
"Industrial Gas Manufacturing in the UK","IBISWorld","Jersey City, United States","Chemicals","United Kingdom",798,"http://www.reportbuyer.com/chemicals/substances/industrial_gas_manufacturing_uk.html","Published on 01-Jan-2011",33
"Water Main, Sewer System &amp; Related Project Construction in the UK","IBISWorld","Jersey City, United States","Energy & Utilities","United Kingdom",806,"http://www.reportbuyer.com/energy_utilities/water/water_main_sewer_system_related_project_construction_uk.html","Published on 07-Jul-2011",27
"Theater Companies and Dinner Theaters in the US","IBISWorld","Jersey City, United States","Leisure & Media","United States",751,"http://www.reportbuyer.com/leisure_media/company_reports_leisure_media/theater_companies_dinner_theaters_us.html","Published on 23-Feb-2006",28
"Dance Companies in the US","IBISWorld","Jersey City, United States","Leisure & Media","United States",751,"http://www.reportbuyer.com/leisure_media/company_reports_leisure_media/dance_companies_us.html","Published on 23-Mar-2006",30
"Musical Groups and Artists in the US","IBISWorld","Jersey City, United States","Leisure & Media","United States",751,"http://www.reportbuyer.com/leisure_media/music/musical_groups_artists_us.html","Published on 18-Oct-2007",39
"Spectator Sports in the US","IBISWorld","Jersey City, United States","Leisure & Media","United States",751,"http://www.reportbuyer.com/leisure_media/attractions/spectator_sports_us.html","Published on 13-Jul-2006",37
"Promoters of Performing Arts, Sports and Similar Events with Facilities in the US","IBISWorld","Jersey City, United States","Leisure & Media","United States",751,"http://www.reportbuyer.com/leisure_media/arts/promoters_performing_arts_sports_similar_events_facilities_us.html","Published on 25-Jul-2007",39
"Promoters of Performing Arts, Sports and Similar Events without Facilities in the US","IBISWorld","Jersey City, United States","Leisure & Media","United States",751,"http://www.reportbuyer.com/leisure_media/arts/promoters_performing_arts_sports_similar_events_without_facilities_us.html","Published on 01-Feb-2008",44
"Agents and Managers for Artists, Athletes, Entertainers and Other Public Figures in the US","IBISWorld","Jersey City, United States","Leisure & Media","United States",751,"http://www.reportbuyer.com/leisure_media/misc_leisure_media/agents_managers_artists_athletes_entertainers_public_figures_us.html","Published on 24-Oct-2007",45
"Independent Artists, Writers and Performers in the US","IBISWorld","Jersey City, United States","Leisure & Media","United States",751,"http://www.reportbuyer.com/leisure_media/arts/independent_artists_writers_performers_us_1.html","Published on 18-Oct-2007",34
"Gold &amp; Silver Ore Mining in the US","IBISWorld","Jersey City, United States","Industry & Manufacturing","United States",821,"http://www.reportbuyer.com/industry_manufacturing/metals/precious_metals/gold_silver_ore_mining_us.html","Published on 03-Mar-2011",32
"Historic Sites in the US","IBISWorld","Jersey City, United States","Leisure & Media","United States",821,"http://www.reportbuyer.com/leisure_media/attractions/historical_sites_us.html","Published on 08-Aug-2011",33
"Religious Organizations in the US","IBISWorld","Jersey City, United States","Business &amp; Government","United States",821,"http://www.reportbuyer.com/business_government/misc_business_services/religious_organizations_us.html","Published on 01-Jan-2011",31
"Lotteries &amp; Native American Reservation Casinos in the US","IBISWorld","Jersey City, United States","Leisure & Media","United States",751,"http://www.reportbuyer.com/leisure_media/gambling/lotteries_native_american_reservation_casinos_us.html","Published on 03-Mar-2010",35
"Grantmaking and Giving Services in the US","IBISWorld","Jersey City, United States","Business &amp; Government","United States",751,"http://www.reportbuyer.com/business_government/misc_business_services/grantmaking_giving_services_us.html","Published on 14-Aug-2007",41
"Social Advocacy Organizations in the US","IBISWorld","Jersey City, United States","Business &amp; Government","United States",751,"http://www.reportbuyer.com/business_government/care_social_services/social_advocacy_organizations_us.html","Published on 30-Sep-2010",37
"Civic and Social Organizations in the US","IBISWorld","Jersey City, United States","Business &amp; Government","United States",751,"http://www.reportbuyer.com/business_government/care_social_services/civic_social_organizations_us.html","Published on 01-Feb-2008",48
"Business Associations in the US","IBISWorld","Jersey City, United States","Business &amp; Government","United States",751,"http://www.reportbuyer.com/business_government/country_overview_business_services/business_associations_us.html","Published on 08-Aug-2009",31
"Professional Organizations in the US","IBISWorld","Jersey City, United States","Business &amp; Government","United States",751,"http://www.reportbuyer.com/business_government/misc_business_services/professional_organizations_us.html","Published on 04-Apr-2009",33
"Labor Unions and Similar Labor Organizations in the US","IBISWorld","Jersey City, United States","Business &amp; Government","United States",751,"http://www.reportbuyer.com/business_government/misc_business_services/labor_unions_similar_labor_organizations_us.html","Published on 10-Mar-2005",24
"Reupholstery &amp; Furniture Repair in the US","IBISWorld","Jersey City, United States","Consumer Goods & Retail","United States",751,"http://www.reportbuyer.com/consumer_goods_retail/services/reupholstery_furniture_repair_us.html","Published on 10-Oct-2009",28
"Private Households in the US","IBISWorld","Jersey City, United States","Consumer Goods & Retail","United States",751,"http://www.reportbuyer.com/consumer_goods_retail/demographics/private_households_us.html","Published on 17-Oct-2007",26
"Tourism in the US","IBISWorld","Jersey City, United States","Leisure & Media","United States",821,"http://www.reportbuyer.com/leisure_media/tourism_travel/tourism_us.html","Published on 04-Apr-2011",37
"Aluminium Smelting in Australia","IBISWorld","Jersey City, United States","Industry & Manufacturing","Australia",829,"http://www.reportbuyer.com/industry_manufacturing/metals/aluminium/aluminium_smelting_australia.html","Published on 09-Sep-2011",29
"Automotive Parts and Accessories Manufacturing in Australia","IBISWorld","Jersey City, United States","Automotive","Australia",829,"http://www.reportbuyer.com/automotive/components/automotive_parts_accessories_manufacturing_australia.html","Published on 08-Aug-2011",35
"Wired Telecommunications Carriers in Australia","IBISWorld","Jersey City, United States","Telecoms","Australia",900,"http://www.reportbuyer.com/telecoms/fixed_line/wired_telecommunications_carriers_australia_1.html","Published on 05-May-2011",51
"Electronic Shopping and Auctions in the US","IBISWorld","Jersey City, United States","Consumer Goods & Retail","United States",751,"http://www.reportbuyer.com/consumer_goods_retail/e_commerce/electronic_shopping_auctions_us.html","Published on 10-Jan-2008",43
"Motorcycle, Bicycle and Parts Manufacturing in the US","IBISWorld","Jersey City, United States","Automotive","United States",751,"http://www.reportbuyer.com/automotive/motorcycles/motorcycle_bicycle_parts_manufacturing_us.html","Published on 28-Nov-2007",49
"Boat Building in the US","IBISWorld","Jersey City, United States","Transport & Travel","United States",821,"http://www.reportbuyer.com/transport_travel/maritime/boat_building_us.html","Published on 06-Jun-2011",40
"Semiconductor and Related Device Manufacturing in the US","IBISWorld","Jersey City, United States","Computing & Electronics","United States",751,"http://www.reportbuyer.com/computing_electronics/semiconductors/semiconductor_related_device_manufacturing_us.html","Published on 17-Jan-2008",51
"Fossil Fuel Electric Power Generation in the US","IBISWorld","Jersey City, United States","Energy & Utilities","United States",751,"http://www.reportbuyer.com/energy_utilities/electricity/fossil_fuel_electric_power_generation_us.html","Published on 12-Dec-2007",37
"Broilers and Other Meat Type Chicken Production in the US","IBISWorld","Jersey City, United States","Food & Drink","United States",751,"http://www.reportbuyer.com/food_drink/meat_poultry/broilers_meat_type_chicken_production_us.html","Published on 03-Sep-2007",43
"Hay &amp; Other Crop Farming in the US","IBISWorld","Jersey City, United States","Industry & Manufacturing","United States",821,"http://www.reportbuyer.com/industry_manufacturing/agriculture/crop/hay_crop_farming_us.html","Published on 11-Nov-2010",33
"Global Direct General Insurance Carriers","IBISWorld","Jersey City, United States","Banking & Finance","All",853,"http://www.reportbuyer.com/banking_finance/insurance/non_life/global_direct_general_insurance_carriers.html","Published on 01-Jan-2011",48
