"The World Market for Oxygen-Function Amino-Compounds","ICON Group ","San Diego,, United States","Chemicals","All",594,"http://www.reportbuyer.com/chemicals/specialty_chemicals/world_market_oxygen_function_amino_compounds.html","Published on 13-May-2010",185
"The World Market for Amino-Alcohols, Their Ethers and Esters, and Salts Thereof, Excluding Esters with More Than One Kind of Oxygen-Function","ICON Group ","San Diego,, United States","Chemicals","All",594,"http://www.reportbuyer.com/chemicals/specialty_chemicals/world_market_amino_alcohols_ethers_esters_salts_thereof_excluding_esters_one_kind_oxygen_function.html","Published on 13-May-2010",152
"The World Market for Amino-Naphthols and Other Amino-Phenols, Their Ethers and Esters, and Salts Thereof, Excluding Esters with More Than One Kind of Oxygen-Function","ICON Group ","San Diego,, United States","Chemicals","All",594,"http://www.reportbuyer.com/chemicals/specialty_chemicals/world_market_amino_naphthols_amino_phenols_ethers_esters_salts_thereof_excluding_esters_one_kind_oxygen_function.html","Published on 13-May-2010",110
"The World Market for Amino-Aldehydes, Amino-Ketones, and Amino-Quinones Excluding Those with More Than One Kind of Oxygen-Function, and Salts Thereof","ICON Group ","San Diego,, United States","Chemicals","All",594,"http://www.reportbuyer.com/chemicals/specialty_chemicals/world_market_amino_aldehydes_amino_ketones_amino_quinones_excluding_one_kind_oxygen_function_salts_thereof.html","Published on 13-May-2010",76
"The World Market for Lysine, Its Esters and Salts Thereof, and Glutamic Acid and Its Salts","ICON Group ","San Diego,, United States","Chemicals","All",594,"http://www.reportbuyer.com/chemicals/specialty_chemicals/world_market_lysine_its_esters_salts_thereof_glutamic_acid_its_salts.html","Published on 13-May-2010",130
"The World Market for Amino-Alcohol-Phenols, Amino-Acid-Phenols, and Other Amino Compounds with Oxygen-Function","ICON Group ","San Diego,, United States","Chemicals","All",594,"http://www.reportbuyer.com/chemicals/specialty_chemicals/world_market_amino_alcohol_phenols_amino_acid_phenols_amino_compounds_oxygen_function.html","Published on 13-May-2010",140
"The World Market for Carboxyamide-Function Compounds and Amide-Function Compounds of Carbonic Acid Excluding Urea","ICON Group ","San Diego,, United States","Chemicals","All",594,"http://www.reportbuyer.com/chemicals/specialty_chemicals/world_market_carboxyamide_function_compounds_amide_function_compounds_carbonic_acid_excluding_urea.html","Published on 13-May-2010",165
"The World Market for Acyclic Amides, Acyclic Carbamates, and Their Derivatives and Salts Thereof","ICON Group ","San Diego,, United States","Chemicals","All",594,"http://www.reportbuyer.com/chemicals/specialty_chemicals/world_market_acyclic_amides_acyclic_carbamates_derivatives_salts_thereof.html","Published on 13-May-2010",128
"The World Market for Ureines, Their Derivatives, and Salts Thereof","ICON Group ","San Diego,, United States","Chemicals","All",594,"http://www.reportbuyer.com/chemicals/specialty_chemicals/world_market_ureines_derivatives_salts_thereof.html","Published on 13-May-2010",85
"The World Market for Quaternary Ammonium Salts and Hydroxides, Lecithins, and Other Phosphoaminolipids","ICON Group ","San Diego,, United States","Chemicals","All",594,"http://www.reportbuyer.com/chemicals/specialty_chemicals/world_market_quaternary_ammonium_salts_hydroxides_lecithins_phosphoaminolipids.html","Published on 13-May-2010",153
"The World Market for Amine-Function Compounds and Carboxyimide-Function Compounds Including Saccharin and Its Salts","ICON Group ","San Diego,, United States","Chemicals","All",594,"http://www.reportbuyer.com/chemicals/specialty_chemicals/world_market_amine_function_compounds_carboxyimide_function_compounds_including_saccharin_its_salts.html","Published on 13-May-2010",126
"The World Market for Acrylonitrile","ICON Group ","San Diego,, United States","Chemicals","All",594,"http://www.reportbuyer.com/chemicals/specialty_chemicals/world_market_acrylonitrile.html","Published on 13-May-2010",60
"The World Market for Diazo-, Azo-, and Azoxy-Compounds","ICON Group ","San Diego,, United States","Chemicals","All",594,"http://www.reportbuyer.com/chemicals/specialty_chemicals/world_market_diazo_azo_azoxy_compounds.html","Published on 13-May-2010",94
"The World Market for Organic Derivatives of Hydrazine or Hydroxylamine","ICON Group ","San Diego,, United States","Chemicals","All",594,"http://www.reportbuyer.com/chemicals/specialty_chemicals/world_market_organic_derivatives_hydrazine_hydroxylamine.html","Published on 13-May-2010",104
"The World Market for Organo-Sulfur Compounds","ICON Group ","San Diego,, United States","Chemicals","All",594,"http://www.reportbuyer.com/chemicals/specialty_chemicals/world_market_organo_sulfur_compounds.html","Published on 13-May-2010",160
"The World Market for Dithiocarbonates (Xanthates)","ICON Group ","San Diego,, United States","Chemicals","All",594,"http://www.reportbuyer.com/chemicals/specialty_chemicals/world_market_dithiocarbonates_xanthates.html","Published on 13-May-2010",64
"The World Market for Thiocarbamates and Dithiocarbamates","ICON Group ","San Diego,, United States","Chemicals","All",594,"http://www.reportbuyer.com/chemicals/specialty_chemicals/world_market_thiocarbamates_dithiocarbamates.html","Published on 13-May-2010",89
"The World Market for Thiuram Mono-, Di-, or Tetrasulfides","ICON Group ","San Diego,, United States","Chemicals","All",594,"http://www.reportbuyer.com/chemicals/specialty_chemicals/world_market_thiuram_mono_di_tetrasulfides.html","Published on 13-May-2010",69
"The World Market for Methionine","ICON Group ","San Diego,, United States","Chemicals","All",594,"http://www.reportbuyer.com/chemicals/specialty_chemicals/world_market_methionine.html","Published on 13-May-2010",102
"The World Market for Lactams and Heterocyclic Compounds with Oxygen Hetero-Atom(s) Only","ICON Group ","San Diego,, United States","Chemicals","All",594,"http://www.reportbuyer.com/chemicals/specialty_chemicals/world_market_lactams_heterocyclic_compounds_oxygen_hetero_atom_s.html","Published on 13-May-2010",167
"The World Market for Lactams","ICON Group ","San Diego,, United States","Chemicals","All",594,"http://www.reportbuyer.com/chemicals/specialty_chemicals/world_market_lactams.html","Published on 13-May-2010",107
"The World Market for Coumarin, Methylcoumarins, and Ethylcoumarins","ICON Group ","San Diego,, United States","Chemicals","All",594,"http://www.reportbuyer.com/chemicals/specialty_chemicals/world_market_coumarin_methylcoumarins_ethylcoumarins.html","Published on 13-May-2010",55
"The World Market for Heterocyclic Compounds with Nitrogen Hetero-Atom(s) Only, Containing an Unfused Pyrazole Ring","ICON Group ","San Diego,, United States","Chemicals","All",594,"http://www.reportbuyer.com/chemicals/specialty_chemicals/world_market_heterocyclic_compounds_nitrogen_hetero_atom_s_only_containing_unfused_pyrazole_ring.html","Published on 13-May-2010",98
"The World Market for Hydantoin and Its Derivatives","ICON Group ","San Diego,, United States","Chemicals","All",594,"http://www.reportbuyer.com/chemicals/specialty_chemicals/world_market_hydantoin_its_derivatives.html","Published on 13-May-2010",80
"The World Market for Heterocyclic Compounds with Nitrogen Hetero-Atom(s) Only, Containing an Unfused Pyridine Ring","ICON Group ","San Diego,, United States","Chemicals","All",594,"http://www.reportbuyer.com/chemicals/specialty_chemicals/world_market_heterocyclic_compounds_nitrogen_hetero_atom_s_only_containing_unfused_pyridine_ring.html","Published on 13-May-2010",151
"The World Market for Heterocyclic Compounds with Nitrogen Hetero-Atom(s) Only, Containing a Quinoline or Isoquinoline Ring-System Not Further Fused","ICON Group ","San Diego,, United States","Chemicals","All",594,"http://www.reportbuyer.com/chemicals/specialty_chemicals/world_market_heterocyclic_compounds_nitrogen_hetero_atom_s_only_containing_quinoline_isoquinoline_ring_system_not_further_fused.html","Published on 13-May-2010",112
"The World Market for Heterocyclic Compounds with Nitrogen Hetero-Atom(s) Only, Containing a Pyrimidine Ring, Piperazine Ring, or Unfused Triazine Ring, and Nucleic Acids and Salts","ICON Group ","San Diego,, United States","Chemicals","All",594,"http://www.reportbuyer.com/chemicals/specialty_chemicals/world_market_heterocyclic_compounds_nitrogen_hetero_atom_s_only_containing_pyrimidine_ring_piperazine_ring_unfused_triazine_ring_nucleic_acids_salts.html","Published on 13-May-2010",177
"The World Market for Heterocyclic Compounds with a Phenothiazine Ring-System but Not Further Fused","ICON Group ","San Diego,, United States","Chemicals","All",594,"http://www.reportbuyer.com/chemicals/specialty_chemicals/world_market_heterocyclic_compounds_phenothiazine_ring_system_not_further_fused.html","Published on 13-May-2010",87
"The World Market for Sulfonamides","ICON Group ","San Diego,, United States","Chemicals","All",594,"http://www.reportbuyer.com/chemicals/specialty_chemicals/world_market_sulfonamides.html","Published on 13-May-2010",123
"The World Market for Ethers, Alcohol Peroxides, Ether Peroxides, Epoxides, Acetals and Hemiacetals, and Their Halogenated, Sulfonated, Nitrated, or Nitrosated Derivatives","ICON Group ","San Diego,, United States","Chemicals","All",594,"http://www.reportbuyer.com/chemicals/specialty_chemicals/world_market_ethers_alcohol_peroxides_ether_peroxides_epoxides_acetals_hemiacetals_halogenated_sulfonated_nitrated_nitrosated_derivatives.html","Published on 13-May-2010",193
"The World Market for Acetals, Hemiacetals, and Their Halogenated, Sulfonated, Nitrated, or Nitrosated Derivatives","ICON Group ","San Diego,, United States","Chemicals","All",594,"http://www.reportbuyer.com/chemicals/specialty_chemicals/world_market_acetals_hemiacetals_halogenated_sulfonated_nitrated_nitrosated_derivatives.html","Published on 13-May-2010",79
"The World Market for Oxirane (Ethylene Oxide)","ICON Group ","San Diego,, United States","Chemicals","All",594,"http://www.reportbuyer.com/chemicals/specialty_chemicals/world_market_oxirane_ethylene_oxide.html","Published on 13-May-2010",64
"The World Market for Methyloxirane (Propylene Oxide)","ICON Group ","San Diego,, United States","Chemicals","All",594,"http://www.reportbuyer.com/chemicals/specialty_chemicals/world_market_methyloxirane_propylene_oxide.html","Published on 13-May-2010",57
"The World Market for Acyclic, Cyclanic, Cyclenic, Cycloterpenic,  Aromatic Ethers, and Their Halogenated, Sulfonated, Nitrated, or Nitrosated Derivatives","ICON Group ","San Diego,, United States","Chemicals","All",594,"http://www.reportbuyer.com/chemicals/specialty_chemicals/world_market_acyclic_cyclanic_cyclenic_cycloterpenic_aromatic_ethers_halogenated_sulfonated_nitrated_nitrosated_derivatives.html","Published on 13-May-2010",139
"The World Market for Ether-Alcohols, Ether-Phenols, Ether-Alcohol-Phenols; Alcohol, Ether, Ketone Peroxides; and Halogenated, Sulfonated, Nitrated, or Nitrosated Derivatives","ICON Group ","San Diego,, United States","Chemicals","All",594,"http://www.reportbuyer.com/chemicals/specialty_chemicals/world_market_ether_alcohols_ether_phenols_ether_alcohol_phenols_alcohol_ether_ketone_peroxides_halogenated_sulfonated_nitrated_nitrosated_derivatives.html","Published on 13-May-2010",168
"The World Market for Aldehyde-, Ketone-, and Quinone-Function Compounds","ICON Group ","San Diego,, United States","Chemicals","All",594,"http://www.reportbuyer.com/chemicals/specialty_chemicals/world_market_aldehyde_ketone_quinone_function_compounds.html","Published on 13-May-2010",180
"The World Market for Acyclic Aldehydes without Other Oxygen Function","ICON Group ","San Diego,, United States","Chemicals","All",594,"http://www.reportbuyer.com/chemicals/specialty_chemicals/world_market_acyclic_aldehydes_without_oxygen_function.html","Published on 13-May-2010",114
"The World Market for Acetone","ICON Group ","San Diego,, United States","Chemicals","All",594,"http://www.reportbuyer.com/chemicals/specialty_chemicals/world_market_acetone.html","Published on 13-May-2010",104
"The World Market for Butanone (Ethyl Methyl Ketone)","ICON Group ","San Diego,, United States","Chemicals","All",594,"http://www.reportbuyer.com/chemicals/specialty_chemicals/world_market_butanone_ethyl_methyl_ketone.html","Published on 13-May-2010",96
"The World Market for Halogenated, Sulfonated, Nitrated, or Nitrosated Derivatives of Aldehyde-Function Compounds Including Aldehydes, Cyclic Aldehyde Polymers, and Paraformaldehyde","ICON Group ","San Diego,, United States","Chemicals","All",594,"http://www.reportbuyer.com/chemicals/specialty_chemicals/world_market_halogenated_sulfonated_nitrated_nitrosated_derivatives_aldehyde_function_compounds_including_aldehydes_cyclic_aldehyde_polymers_paraformaldehyde.html","Published on 13-May-2010",74
"The World Market for Camphor","ICON Group ","San Diego,, United States","Chemicals","All",594,"http://www.reportbuyer.com/chemicals/specialty_chemicals/world_market_camphor.html","Published on 13-May-2010",52
"The World Market for Aromatic Ketones, Ketone Alcohols, Aldehydes, Phenols, Quinones, and Their Halogenated, Sulfonated, Nitrated, or Nitrosated Derivatives","ICON Group ","San Diego,, United States","Chemicals","All",594,"http://www.reportbuyer.com/chemicals/specialty_chemicals/world_market_aromatic_ketones_ketone_alcohols_aldehydes_phenols_quinones_halogenated_sulfonated_nitrated_nitrosated_derivatives.html","Published on 13-May-2010",145
"The World Market for Esters of Inorganic Acids, Their Salts, and Their Halogenated, Sulfonated, Nitrated or Nitrosated Derivatives","ICON Group ","San Diego,, United States","Chemicals","All",594,"http://www.reportbuyer.com/chemicals/specialty_chemicals/world_market_esters_inorganic_acids_salts_halogenated_sulfonated_nitrated_nitrosated_derivatives.html","Published on 13-May-2010",150
"The World Market for Phosphoric Esters, Lactophosphates, Their Salts, and Their Halogenated, Sulfonated, Nitrated, or Nitrosated Derivatives","ICON Group ","San Diego,, United States","Chemicals","All",594,"http://www.reportbuyer.com/chemicals/specialty_chemicals/world_market_phosphoric_esters_lactophosphates_salts_halogenated_sulfonated_nitrated_nitrosated_derivatives.html","Published on 13-May-2010",112
"The World Market for Hydrogen, Rare Gases, Nitrogen, and Oxygen","ICON Group ","San Diego,, United States","Chemicals","All",594,"http://www.reportbuyer.com/chemicals/substances/world_market_hydrogen_rare_gases_nitrogen_oxygen.html","Published on 13-May-2010",124
"The World Market for Selenium, Tellurium, Phosphorus, Arsenic, and Boron","ICON Group ","San Diego,, United States","Chemicals","All",594,"http://www.reportbuyer.com/chemicals/substances/world_market_selenium_tellurium_phosphorus_arsenic_boron.html","Published on 13-May-2010",88
"The World Market for Silicon","ICON Group ","San Diego,, United States","Chemicals","All",594,"http://www.reportbuyer.com/chemicals/substances/world_market_silicon.html","Published on 13-May-2010",102
"The World Market for Chlorine","ICON Group ","San Diego,, United States","Chemicals","All",594,"http://www.reportbuyer.com/chemicals/substances/world_market_chlorine.html","Published on 13-May-2010",91
"The World Market for Fluorine, Bromine, and Iodine","ICON Group ","San Diego,, United States","Chemicals","All",594,"http://www.reportbuyer.com/chemicals/substances/world_market_fluorine_bromine_iodine.html","Published on 13-May-2010",75
"The World Market for Sublimed or Precipitated Sulfur and Collodoidal Sulfur","ICON Group ","San Diego,, United States","Chemicals","All",594,"http://www.reportbuyer.com/chemicals/substances/world_market_sublimed_precipitated_sulfur_collodoidal_sulfur.html","Published on 13-May-2010",63
"The World Market for Mercury","ICON Group ","San Diego,, United States","Chemicals","All",594,"http://www.reportbuyer.com/chemicals/substances/world_market_mercury.html","Published on 13-May-2010",56
"The World Market for Sodium and Other Alkali Metals","ICON Group ","San Diego,, United States","Chemicals","All",594,"http://www.reportbuyer.com/chemicals/substances/world_market_sodium_alkali_metals.html","Published on 13-May-2010",64
"The World Market for Calcium, Strontium, Barium, Rare Earth Metals, Scandium, and Yttrium","ICON Group ","San Diego,, United States","Chemicals","All",594,"http://www.reportbuyer.com/chemicals/substances/world_market_calcium_strontium_barium_rare_earth_metals_scandium_yttrium.html","Published on 13-May-2010",67
"The World Market for Inorganic Acids and Inorganic Oxygen Compounds of Nonmetals","ICON Group ","San Diego,, United States","Chemicals","All",594,"http://www.reportbuyer.com/chemicals/substances/world_market_inorganic_acids_inorganic_oxygen_compounds_nonmetals.html","Published on 13-May-2010",210
"The World Market for Hydrogen Chloride, Hydrochloric Acid, and Chlorosulfuric Acid","ICON Group ","San Diego,, United States","Chemicals","All",594,"http://www.reportbuyer.com/chemicals/substances/world_market_hydrogen_chloride_hydrochloric_acid_chlorosulfuric_acid.html","Published on 13-May-2010",107
"The World Market for Sulfuric Acid and Oleum","ICON Group ","San Diego,, United States","Chemicals","All",594,"http://www.reportbuyer.com/chemicals/substances/world_market_sulfuric_acid_oleum.html","Published on 13-May-2010",105
"The World Market for Nitric Acid and Sulfonitric Acids","ICON Group ","San Diego,, United States","Chemicals","All",594,"http://www.reportbuyer.com/chemicals/substances/world_market_nitric_acid_sulfonitric_acids.html","Published on 13-May-2010",90
"The World Market for Diphosphorus Pentoxide, Phosphoric Acid, and Polyphosphoric Acids","ICON Group ","San Diego,, United States","Chemicals","All",594,"http://www.reportbuyer.com/chemicals/substances/world_market_diphosphorus_pentoxide_phosphoric_acid_polyphosphoric_acids.html","Published on 13-May-2010",123
"The World Market for Boron Oxides and Boric Acids","ICON Group ","San Diego,, United States","Chemicals","All",594,"http://www.reportbuyer.com/chemicals/substances/world_market_boron_oxides_boric_acids.html","Published on 13-May-2010",91
"The World Market for Silicon Dioxide","ICON Group ","San Diego,, United States","Chemicals","All",594,"http://www.reportbuyer.com/chemicals/substances/world_market_silicon_dioxide.html","Published on 13-May-2010",132
"The World Market for Sulfur Dioxide","ICON Group ","San Diego,, United States","Chemicals","All",594,"http://www.reportbuyer.com/chemicals/substances/world_market_sulfur_dioxide.html","Published on 13-May-2010",52
"The World Market for Halogen or Sulfur Compounds of Nonmetals","ICON Group ","San Diego,, United States","Chemicals","All",594,"http://www.reportbuyer.com/chemicals/substances/world_market_halogen_sulfur_compounds_nonmetals.html","Published on 13-May-2010",99
"The World Market for Halides and Halide Oxides of Nonmetals","ICON Group ","San Diego,, United States","Chemicals","All",594,"http://www.reportbuyer.com/chemicals/substances/world_market_halides_halide_oxides_nonmetals.html","Published on 13-May-2010",87
"The World Market for Sulfides of Nonmetals and Commercial Phosphorus Trisulfide","ICON Group ","San Diego,, United States","Chemicals","All",594,"http://www.reportbuyer.com/chemicals/substances/world_market_sulfides_nonmetals_commercial_phosphorus_trisulfide.html","Published on 13-May-2010",64
"The World Market for Oxides of Zinc, Chromium, Manganese, Iron, Cobalt, Titanium, and Lead","ICON Group ","San Diego,, United States","Chemicals","All",594,"http://www.reportbuyer.com/chemicals/substances/world_market_oxides_zinc_chromium_manganese_iron_cobalt_titanium_lead.html","Published on 13-May-2010",194
"The World Market for Zinc Oxide and Zinc Peroxide","ICON Group ","San Diego,, United States","Chemicals","All",594,"http://www.reportbuyer.com/chemicals/substances/world_market_zinc_oxide_zinc_peroxide.html","Published on 13-May-2010",112
"The World Market for Chromium Oxides and Hydroxides","ICON Group ","San Diego,, United States","Chemicals","All",594,"http://www.reportbuyer.com/chemicals/substances/world_market_chromium_oxides_hydroxides.html","Published on 13-May-2010",100
"The World Market for Manganese Oxides","ICON Group ","San Diego,, United States","Chemicals","All",594,"http://www.reportbuyer.com/chemicals/substances/world_market_manganese_oxides.html","Published on 13-May-2010",92
"The World Market for Iron Oxides, Iron Hydroxides, and Earth Colors of 70% or More Combined Iron Evaluated as Fe203 by Weight","ICON Group ","San Diego,, United States","Chemicals","All",594,"http://www.reportbuyer.com/chemicals/substances/world_market_iron_oxides_iron_hydroxides_earth_colors_70_combined_iron_evaluated_fe203_weight.html","Published on 13-May-2010",134
"The World Market for Cobalt Oxides, Cobalt Hydroxides, and Commercial Cobalt Oxides","ICON Group ","San Diego,, United States","Chemicals","All",594,"http://www.reportbuyer.com/chemicals/substances/world_market_cobalt_oxides_cobalt_hydroxides_commercial_cobalt_oxides.html","Published on 13-May-2010",85
"The World Market for Titanium Oxides","ICON Group ","San Diego,, United States","Chemicals","All",594,"http://www.reportbuyer.com/chemicals/substances/world_market_titanium_oxides.html","Published on 13-May-2010",132
"The World Market for Red Lead, Orange Lead, and Lead Oxides","ICON Group ","San Diego,, United States","Chemicals","All",594,"http://www.reportbuyer.com/chemicals/substances/world_market_red_lead_orange_lead_lead_oxides.html","Published on 13-May-2010",83
"The World Market for Anhydrous Ammonia or Ammonia in Aqueous Solution","ICON Group ","San Diego,, United States","Chemicals","All",594,"http://www.reportbuyer.com/chemicals/substances/world_market_anhydrous_ammonia_ammonia_aqueous_solution.html","Published on 13-May-2010",111
"The World Market for Solid Sodium Hydroxide (Caustic Soda)","ICON Group ","San Diego,, United States","Chemicals","All",594,"http://www.reportbuyer.com/chemicals/substances/world_market_solid_sodium_hydroxide_caustic_soda.html","Published on 13-May-2010",132
"The World Market for Sodium Hydroxide in Aqueous Solution, Soda Lye, or Liquid Soda","ICON Group ","San Diego,, United States","Chemicals","All",594,"http://www.reportbuyer.com/chemicals/substances/world_market_sodium_hydroxide_aqueous_solution_soda_lye_liquid_soda.html","Published on 13-May-2010",116
"The World Market for Potassium Hydroxide (Caustic Potash) and Peroxides of Sodium or Potassium","ICON Group ","San Diego,, United States","Chemicals","All",594,"http://www.reportbuyer.com/chemicals/substances/world_market_potassium_hydroxide_caustic_potash_peroxides_sodium_potassium.html","Published on 13-May-2010",107
"The World Market for Magnesium Hydroxide, Magnesium Peroxide, and Oxides, Hydroxides, and Peroxides of Stronium or Barium","ICON Group ","San Diego,, United States","Chemicals","All",594,"http://www.reportbuyer.com/chemicals/substances/world_market_magnesium_hydroxide_magnesium_peroxide_oxides_hydroxides_peroxides_stronium_barium.html","Published on 13-May-2010",88
"The World Market for Aluminum Hydroxide","ICON Group ","San Diego,, United States","Chemicals","All",594,"http://www.reportbuyer.com/chemicals/substances/world_market_aluminum_hydroxide.html","Published on 13-May-2010",101
"The World Market for Artificial Corundum","ICON Group ","San Diego,, United States","Chemicals","All",594,"http://www.reportbuyer.com/chemicals/substances/world_market_artificial_corundum.html","Published on 13-May-2010",102
"The World Market for Hydrazine, Hydroxylamine, and Their Inorganic Salts","ICON Group ","San Diego,, United States","Chemicals","All",594,"http://www.reportbuyer.com/chemicals/substances/world_market_hydrazine_hydroxylamine_inorganic_salts.html","Published on 13-May-2010",76
"The World Market for Metallic Salts and Peroxysalts of Inorganic Acids","ICON Group ","San Diego,, United States","Chemicals","All",594,"http://www.reportbuyer.com/chemicals/substances/world_market_metallic_salts_peroxysalts_inorganic_acids.html","Published on 13-May-2010",113
"The World Market for Chlorides, Chloride Oxides and Hydroxides, Bromides and Bromide Oxides, and Iodides and Iodide Oxides","ICON Group ","San Diego,, United States","Chemicals","All",594,"http://www.reportbuyer.com/chemicals/substances/world_market_chlorides_chloride_oxides_hydroxides_bromides_bromide_oxides_iodides_iodide_oxides.html","Published on 13-May-2010",173
"The World Market for Ammonium Chloride","ICON Group ","San Diego,, United States","Chemicals","All",594,"http://www.reportbuyer.com/chemicals/substances/world_market_ammonium_chloride.html","Published on 13-May-2010",73
"The World Market for Calcium Chloride","ICON Group ","San Diego,, United States","Chemicals","All",594,"http://www.reportbuyer.com/chemicals/substances/world_market_calcium_chloride.html","Published on 13-May-2010",100
"The World Market for Hypochlorites, Commercial Calcium Hypochlorite, Chlorites, Hypobromites, Chlorates and Perchlorates, Bromates and Perbromates, and Iodates and Periodates","ICON Group ","San Diego,, United States","Chemicals","All",594,"http://www.reportbuyer.com/chemicals/substances/world_market_hypochlorites_commercial_calcium_hypochlorite_chlorites_hypobromites_chlorates_perchlorates_bromates_perbromates_iodates_periodates.html","Published on 13-May-2010",160
"The World Market for Hypochlorites, Commercial Calcium Hypochlorite, Chlorites, and Hypobromites","ICON Group ","San Diego,, United States","Chemicals","All",594,"http://www.reportbuyer.com/chemicals/substances/world_market_hypochlorites_commercial_calcium_hypochlorite_chlorites_hypobromites.html","Published on 13-May-2010",126
